"","userNames","userTweets","followers"
"22","Diario Crónica Py","fiscal pide prision para imputado por hurto agrav con goleada dijo adios a la cop destruyen laboratorio de procesamiento de cocain locote “volador” en el buen pastor atropello barrera y volc ante santa fe el verdadero part alistan ambulancia para los “contreras” “playa nudista” de campesin cerro fue un desierto en chil “ andate farias ” arrastro a policia por cuadras y lo decapit extraño ser acosa a toda una famili no se pronostican lluvias y la jornada seria calur suicidios por ahorcamiento y muertes por electrocu paraguay y china taiwan “un solo corazon” mas negocios y universidad en mandarin cartes desplegara jornada de gobierno desde mburuvicha rog humor por yor portada de la seccion deport maitei rory gente compartimos los principales titulos de la edicion impresa excelente jornada para tod  chicos paso the flash y comento que su gif va muy rapido bndcns famosos enseñaron sobre tecnologia g mensaje especial de fabi para un ex hombre que tenia relaciones sexuales en un automovil arrolla y mata a un polic comenzo la xviii cumbre judicial iberoamerican casos de dengue en alza en el departamento central se viene la iii edicion de la feria nacional de los pueblos indigen en corea no compran votos con vaca’i sino con “levantol” este nene es mas bocho que einstein remeras “en guarani” tempranero jejuka en ciudad del est sinafocal entregara certificados de capacitacion a misioner refinanciar deuda en vez de condon “aqui sobresale el equipo” un “ ” suplente ira por el honor ya venden termos “para ti mama”   motoca “nalgueo” a ciclista y hu “aulas moviles” para jose falcon antonella matterazzi se despacho todo mal ra’ micreros sumariados por “vivos” hay un onur paraguayito en vaqu abogado hizo correr a mondaha   hicieron “pure” de mondaha   “irra” inicio su guerra a la “o” epidemia de piojos ataca a niñ salta el “rosario” de capturas de elvio benitez culpa a limpiavidrios de reventarle el vidri nadia ferreira denuncia alguien se hace pasar por ella en whatsapp chatarra jeyma no fue tragedia… de milagr cerro porteño quiere soplar bien fuerte en la altur ljubetic renuncio a la justicia electoral cartes ahondaria hoy en propuesta para productores de itapu a preparar pilotos paraguas y botas de lluvi el productor de cine y television andy del puerto esta hoy de cumpleañ portada de la seccion deport maitei rory gente compartimos los principales titulos de la edicion impresa excelente jornada para tod rodrigo piensa en ganar nomas preocupa la extrema delgadez de la actriz y cantante tini stoessel auge peloteril acelera venta de teles chuchis chokokue de itapua se pronuncian contra condonacion de deud sol encandila otra vez en el apertur a santa fe el partido a gan “trico” se siente persegu tres fechas a medi preparan demanda contra doña florind transexual debuta en torneo femenin el dt luqueño con dos model la tarde de festejo de enrique vargas peñ inundaciones dejan sin hogar a curep se dejo del novio y mostro su potencial",64889
"23","Última Hora","estado necesita de mas dinero para financiar los programas sociales y demas problem automovilistas molestos por manifestaciones  se hablo de formalizar la economia y vamos a hacer eso condonando a transportistas sin impuestos a la soj estoy a favor de la derogacion ivaacooper tambien debemos de pensar en las cooperativas mas pequeñ dip olimpio villalba yo estoy a favor de que se proteja este sector de la economia tan import ahora no podemos aplicar el iva al acto cooperativo consideramos que esto no es correct campesinos marcha por la calle caballero marchacampesin presidente colegas deroguemos el iva al acto cooperativo estas de acuerd las cooperativas pagan iva lo que se pretende ahora es el iva al acto cooper porque atacar un sector a tan product lastimosamente no llego la orden del presidente de aplazar este punto por dias y sentarnos a dialogar dip edgar acost campesinos de la fnc sumados a la marcha este sector si bien apoyaba de palabras ahora se suma de forma vis opinionuh el reclamo campesino  por gustavo olmedo lee mas aqu recolectan firma para solicitar a la junta municipalidad de cde la intervencion de la municipal mundo terremoto sacude japon sin alerta de tsunami  movilizacion calienta sesion en diputados   tendencia en senado es postergar condonacion  los cooperativistas van ingresando a plaza uruguay ahora manifestacion por la transparencia en cde la concentracion en en la plaza de la paz de cde victor rios recordo condonacion y subsidios a sojeros ganaderos y empresarios del transport ahora manifestantes se dirigen a la plaza uruguaya donde se encontraran con otro grupo de manifest victor rios“el que acusa de populista a los que apoyan a campesinos que se manifiestan jamas leyo ni en wikipedia lo que eso significa” sitrande se adhiere y muestra su apoyo a los sectores que exigen sus reivind diputado vera bejarano critica al gobierno y perla de vazquez defiende a cartes “presencia del estado como nunca ha llegado a san pedro” organizaciones lgbti se suman a protestas  ahora cierre av brasil y tte fariña tambien se corto el paso de fdo de la mora zona del merc titular de diputados condiciona reunion con campesinos   ahora cooperativistas llegan a la plaza de armas para aguardar el tratamiento del iva a en la camara de diput habilitan super que atendera las horas  aprehenden a ladron domiciliario en asuncion  denuncian mala calidad de chipas de merienda escol a cartes le preocupa movilizacion de campesinos asegura ministr invierno paraguayo prevaleceran los dias de calor hasta mediados de julio  cooperativas haran hoy otro asueto para protestar contra el iva la tendencia en senado hoy es postergar la condon secretario viajero cobro viaticos por g millones en los ultimos años  clima anuncian jueves caluroso con lluvias dispersas  editorial riesgosa percepcion ciudadana de ausencia de justicia social  buenos dias compartimos la tapa uhpy de hoy con los siguientes titulos principal etc subastan dos pistolas de simon bolivar por usd millon eeuu confirma la relacion directa entre zika y la microcefali mundo iglesia uruguaya pide perdon y ofrece compromiso a victimas de abuso sexual presentan aplicacion para el acceso a la justicia en cumbre judicial papelespanama sin evidencia contundente de delito termina allanamiento a mossack fonsec no hubo dialogo entre campesinos y el gobiern anulan laboratorio de cocaina en amambay disney prepara una pelicula de peter pan con actores real docente de la university of texas capacito a medicos de clin temporal destruyo cultivos en minga guazu mas sectores se suman a la vigilia contra la corrupcion frente al mec etc joven tetraplejico recupera la movilidad en los dedos gracias a un chip abogado fue condenado a años de carcel por abuso sexual en niñ cde policia abre sumario contra agentes vinculados a supuesta extorsion cae frondoso arbol en ciudad del est alerta se mantiene vigente para ocho departament cep pide sensatez a los politicos ante reclamos de campesinos y cooperativ un oscuro cerro porteño cae en chile y ahora esta obligado a vencer a santa fe d paraguay y taiwan consolidan alianza comercial mirando al mercosur piden cambio de docente por reiteradas ausencias   especiales quien nos ha robado el mes de abril   etc mas alla de un beso en su dia  denuncian a escribana mayor martha narvaja  pesaran camiones que rompen la ruta concepcion vallemi  tsje lamenta renuncia de ljubetic  amplian alerta meteorologica a departamentos  sacaran de circulacion la vacuna sabin  calles inundadas y pobladores sin agua en el chaco central  ",480951
"24","El Siglo de Panamá","compra elsiglo recorta el cintillo y canjealos por una entrada al concierto revivel ceremonia de ascenso cuenta con presencia de ministro de seguridad  via   inicia ceremonia de ascenso de  via   universidad de panama va a esclarecer los resultados de las investigaciones de la fundacion universidad de panama gt v reportan trafico muy pesado en la via centenario por vuelco de camion de repart asi quedo la tabla de posiciones del beisbolmayor tras la culminacion de la jornada de ay asi se encuentra la clasificacion general antes de que inicie la jornada del torneo clausur cocle reportan daño en la potabilizadora de penonome desde anoche la gente esta sin agu mossackfonsecapapers putin vincula escandalo financiero con elecciones legislativas rusas  mundo papa francisco visitara la isla griega lesbos el sabado para mostrar cercania a los refugi mundo autoridades de malasia destruyeron toneladas de marfil africano ilegal valorado en millon mundo palestino ataco con un hacha a un soldado israeli en cisjordania y fue abatido por otros militar estabilizaciontransporte piratas le quitaron al metrobus mil usuarios alfonso pened estabilizaciontransporte alfonso penedo hoy en dia mi problema no es la competencia sino mi incompetent estabilizaciontransporte alfonso penedo administrador del metrobus asegura que por dia buses estan fuera de servicio por manten estabilizaciontransporte metrobus tendra carriles exclusivos en algunas vias corredores norte y sur estan en la l infidencias y confidencias del de abril del   gt laroja ‘no representaba peligro   gt laroja dos heridos por triple colision gt juzgado niega fianza de excarcelacion a ‘tercero   gt laroja destino de la cocaina era belgica gt disfruta de un rico jugo de mango y durazno gt eureka papa por siempre  gt eleva el placer con mucha adrenalina gt espectaculo zafiro cantaran en chiriqui  gt espectaculo florinda confirma amor con quico  gt anuncio que mibus contratara operadores para mejorar la frecuencia de los metrobus operadores del metrobus recibiran capacitacion de meses para obtener licencia tipo j y un aumento salarial espectaculo tino castro estara con sus artistas   gt espectaculos liza y doralis piden disculpas gt ‘wise mil despunta  gt deportes mets frenan su mala racha gt deportes olmecas le dan de baja a luis durango  gt deportes ‘la roca de gracia y gomez suben hoy a la bascula  gt experta en ambiente advierte sobre repercusiones del cambio climatico en el pais  gt economia arranca expo vivienda  gt baja en la gasolina sera minima  gt mundo capturan a miembros del peligroso clan úsuga  gt mundo detectan vinculo zika microcefalia   gt van asesinados en haiti  gt brasil luchara hasta el final gt docentes solicitan eliminar praa   gt panama designan magistrada del tribunal administrativo tributario   gt diputados de la archivan denuncias contra   gt pide romper relaciones con francia y la ocde  gt laroja ‘a mi hijo lo mataron por rabia o envidia   gt deportes la plantilla mas costosa  dirigente revela que se gastan mas de mil  gt como hacer salsa alfredo  gt compra elsiglo recorta el cintillo y canjealos por una entrada al concierto revivel evita referirse al futuro de mossack fonseca  gt ‘oficialmente embajador gt los mas burocraticos   gt ahora la policia y servir tiene un robocop en sus fil sargento primero saturnino camacho gano en la categoria de en kilometr cinco paises piden ayuda judicial a panama para investigar ‘blanqueo   gt agente jessica samudio gano maraton en la categoria de joven economia energia sera mas barata  gt teniente nicolas garcia gano la maraton de km de en la categoria años en adel cualquiera realidad es pura coincidencia le adelantamos la caricatura de que tengan un felizjuev deportes stephen curry no es humano metio triples en una temporada rompio el record anterior que er te adelantamos la portada de hoy ganan partidos en una temporada de nba y rompen el record de los curry metio punt kobe lanzo veces colo y encesto de la linea al final metio puntos jordan en su ultimo juego anot mostro kobe bryant jugo su ultimo partido de y metio puntos ganaron a  compra elsiglo recorta el cintillo y canjealos por una entrada al concierto revivel la celebracion del dia del policia se festejara con este pedazo de dulc opinion que te parece la caricatura de hoy jueves por informa que colision entre pirata y taxi dejo tres her un dia como hoy pero de se hundio el titanic han pasado añ sazon con senafront banda de una de las instituciones invitadas al evento d",39514
"25","Diario DiaaDia","aficiondd analizan el paso de nurse por el futbol mexican elpaisdd sin agua este domingo por desvio de linea en via tocumen   elpaisdd reportan cierre de calle en la via interamericana por el area de rio cocle dat aficiondd chiriqui no tuvo piedad de panama oest aficiondd curry y los warriors hacen histori elpaisdd reportan accidente en el nancito y el salado en remedios hubo heridos dat aficiondd pone fin a su carrera al estilo hollywood aficiondd las estrellas estaran en el rod carew   aficiondd los mets vuelven a ver la luz acabo a los marlins   aficiondd retiran numero de manuel rodriguez   aficiondd pep guardiola no se presiona por ganar la champions   aficiondd el delantero del real madrid karim benzema no jugara la eurocopa   aficiondd al portero jaime penedo ya lo ven como una garantia para el deportivo saprissa   aficiondd no hay alarma  los asientos vacios han sido una constante en los estadios   aficiondd el atletico de madrid derroto al barcelona para clasificarse a las semifinales   famadd el de mayo presentan oficialmente a luz en las tablas y para junio en panama   elpaisdd mas de la celebracion de los años de v elpaisdd desde tempranas horas realizan la celebracion por aniversario de v famadd emocionado y agradecido fue el sentir del ex sin bandera noel schajris   elpaisdd camion se vuelca en la via centenario por el rod carew dat elpaisdd pension alimenticia mucha tela por cort elpaisdd patacon genera electr elpaisdd comidas chatarra siguen en escuel primerplanodd detras del uniform aficiondd la culpa siempre es de gavilan famadd para muchos las paces de liza hernandez y doralis mela fue una burl opinadd que piensa sobre el anuncio del presidente sobre el tema del transporte publ famadd dejen la mentira al chollykid no lo han suspendido   famadd gisela tuñon sale de calle vip por orden medica   elpaisdd css anuncia reprogramacion de citas para el de mayo   mira las noticias de forma diferente divertida y gratis aqu elpaisdd onpar capacita a unidades de la policia nacional   elpaisdd índice de precios al consumidor nacional urbano aumenta   elpaisdd abastecen a comunidades en los santos   elpaisdd atienden a familias albergadas en escuela nicolas pacheco   elpaisdd mides realiza pago de programas sociales   aficiondd panama sede de los juegos latinoamericanos de olimpiadas especiales  famadd juan gabriel lanza video junto a marc anthony gt aficiondd todo listo para el home run derby y el juego de las estrell teimaginasdd video hoy es el dia internacional del beso gt famadd nilka no cree en etiqueta va a la alfombra roja en short famadd gisela tuñon sale de calle vip por orden med elpaisdd costa rica devolvera a panama a cubanos ilegales gt famadd condorito ira al cine gt vuelve la cocina que necesitas con y la doña el lunes de abril elpaisdd firman decreto para mejorar transporte gt mundodd ee uu confirma relacion directa zika y microcefalia gt famadd noel es el embajador de las olimpiadas especiales de panam teimaginasdd nicaragua convertira en destino turistico huellas humanas gt mundodd polemica en colombia por licencia de explotacion petrolera gt tierraadentrodd damnificados dejo incendio en bocas del tor vuelve la cocina que necesitas con y la doña el lunes de abril elpaisdd abastecen a comunidades en los santos   elpaisdd porcell habla sobre allanamiento a oficinas mossack fonseca en panam elpaisdd índice de precios al consumidor nacional urbano aumenta   elpaisdd mas temprano se reporto colision por loma cova dat opinadd cual cree usted que debe ser la sancion para las personas que dejan a los niños abandon elpaisdd mas temprano se reporto hecho de transito en calle la chorrera dat elpaisdd mas temprano enfrentamiento entre unidades policiales y baruenses en paso canoas dat elpaisdd mas de cubanos ingresan a la fuerza a territorio costarricense por paso canoas v elpaisdd onpar capacita a unidades de la policia nacional   famadd gisela tuñon sale de calle vip por orden med elpaisdd sorprenden a mas conductores circulando con placas venc elpaisdd capturan a sujetos por tala ilegal en el parque soberan aficiondd cubano hector olivera arrestado por agresion a muj famadd condorito ira al cine gt",78922
"26","La Jornada","consul en nicaragua paula martinez afirmo que mil nicaragüenses solicitan visa al añ presidenta de corte suprema de justicia alba luz ramos valora en alto la mediacion de dirac en su xvi años nicaragu policia de transito de nicaragua estima que cada minutos agentes multan a un conductor con un promedio de personas diari desde elsalvador elsalvador gobierno propone la organizacion de grupos civiles para hacer frente a expansion de las pandill vas al cine trailers <U+25BA> un diputados del fsln afirma que el proyecto tumarin nicaragua se ha pausado debido a la crisis politica que ocurre en brasil ineter advierte que temperaturas podrian llegar a los grados centigrados en chinandega nicaragu confirman visita a nicaragua de quien ofrecera un concierto el de mayo a los nicaragüens y promueven el zafarrancho en managua viernes abr pm con varios artistas nacional fmi revela que precios bajos del petroleo han influido mucho en una mejor percepcion economica de centroamerica p los obispos de nicaragua emitieron una disculpas ante la falta de consenso que ha impedido emitir la cartapastoral a feligreses catol informa de cada atentados terroristas ejecutados en nigeria camerun chad y niger por bokoharam lo hicieron niñ crece fanaticos por liga europea en nicaragu cuba y nicaragua no asistieron a reunion por crisis de migrantes cubanos hay miles de ellos varados en panam comenzo encuentro de obispos de nicaragua el dia de hoy informan sobre la ta etapa que tendra el puerto salvador allende managua nicaragua incluira hasta una sala de cin dilmarousseff presidenta de brasil acusa a su vicepresidente de estar conspirando contra su propio gobiern suscribase a nuestros envios diarios para estar informado de lo que ocurra en nicaragu mañana martes se reuniran en costarica vicecancilleres y directores de migracion para discutir temas de la migracion de cuban un representante de la presidencia de nicaragua afirma que hay enormes espectativas a que el invierno sera buen alcaldia de managua nicaragua presento plan de ampliacion de vias publ desde eeuu afirman que el virus del zika tiene un mayor impacto de lo estim la corte suprema de justicia de nicaragua no acepto la extradicion de sospechoso de asesinar a una familia entera en costar lindos modulos de madera entregaron autoridades intur nicaragua a comerciantes frente managu muere personas y heridas por explosion pirotecnica en sur d aparecio frances franck joel daniel villain desaparecido el viernes abril en volcan cosiguina nicaragu dr leonel ayala fundador grupos de sicoterapia gsa hay un recondito de la genetica que cada humano debe dinamiz los incendios forestales siguen haciendo de las suyas destruyen reservas naturales en chinandega y managua nicaragu realizan interesante concurso donde premiaran a los municipios mas limpios de nicaragu bac firma acuerdo con para mejorar el acceso al credito de las mujeres dueñas de pymes en nicaragu spacex logra por primera vez aterrizar un cohete en el oceano informan desde l fuego se mantiene en las laderas de la lagunadenejapa nicaragu reportan choque de trenes en costarica centroamerica con un saldo aproximado de her circula redes sociales carta dnd una d las tias d maria angelica chamorro afirma no s suicido sino la suicid iniser entrega premios y motocicletas entre sus clientes en promocion realizada durante dos meses nicaragu doctor leonel ayala filosofia del bien vivir gsa amor comprension humildad tolerancia y gratitud nicaragu en la rotonda la virgen managua nicaragua ya comienzan a ejercitar las personas tras un dia mas de trabaj corina del carmen centeno rocha es la nueva procuradora general para la defensa de los derechos humanos nicaragu policia nacional aclara que maria angelica chamorro se suicido y no la asesinaron a como se rumora nicaragu fabio gadea mantilla le canto cero a candidatura por el plinicaragua las razon fue aguacero de lluvias lo que ha caido en diversas zonas de nicaragua reportan ciudadanos a la jorn ineter los vientos en managua han aumentado de veloc uruguay es la sede de la proxima conferencia regional sobre la mujer del al de octubre de en montevide whatsapp incrementa niveles de seguridad y encriptacion tras caso entre apple y fbi de fondos destinados para lucha contra el ebola eeuu utilizara parte de ello para estudiar y hacer frente al zik embajador de kenny bell entrega pte jose adan aguerri exportar a ue nicaragu miriam vargas de sinsa entrego premios de promocion verano de nicaragu no puedo culpar a nadie del despale dice michael hialey de upanic pregunten a marena y a inafor dic michael healey de upanic dice que los productores de ganado podran vender en el exterior nicaragua precios mejor hoy fue la misa de la primera semana del mes de los devotos de la antigua imagen de sangre de cristo nicaragu liberales de la unidad liderada por el plc nicaragua solicitan la renuncia de noel vidaurre a traves de una carta escrit probable candidatura de arnoldo aleman lacayo en alianza del plc hay especulaciones con renuncia de noel vidaurre nicaragu luis suarez del barcelona se impuso — sobre athletic partido captado en nicaragu volvio a explotar el volcan momotombo reportan servicios radiales es volcan mas activo nicaragu el presidente del banco central de nicaragua realizo la presentacion de su informe ante la asamblea nacional obama no mira viable el proyecto de donaldtrump ante construccion de muro con mex noel vidaurre renuncio a la candidatura de la unidad liberal sindical liderada por el plc nicaragu presenta app mi movistar para una autoadministracion rapida y agil de la cuenta nicaragu el volcanmomotombo lleva explosiones desde que inicio actividad en diciembre informa ineter nicaragu suscribase a nuestros envios diarios para estar informado de lo que ocurra en nicaragu hoy sesion en nicaragua grupos de sicoterapia de la linea dr ayala gsa para superar alcoholismo drogas y adiccion van casos positivos de dengue informa gobierno de nicaragu inicio la campaña nacional de vacunacion en nicaragu ineter nicaragua confirma que el fenomeno de elniño se ha ido debilitando en ultimos d autoridades ambientales de honduras informan que plaga de gorgojo ha destruido mas de mil hectareas de pinar los muelles costeros al lagococibolca han practicamente desaparecido debido a la disminucion de agua advierten autor el salsero de nicaragua luis enrique dio su apoyo al genero del regueton durante una entrevista hecha por inauguran call center en managua nicaragua con inversion de u milllones representantes aseguran salario de u x agent hoy estaran inaugurando un nuevo call center en managua nicaragua que dara empleo a mas de personas se llama ibex global",672
