"","userNames","userTweets","followers"
"1","CNN en Español","retiran publicidad de portal de citas que decias que las pecas eran imperfecciones  argentina terminara con años de cese de pagos  la noche historica de la nba el adios de kobe los de curry y los de golden stat putin acusa a estados unidos de estar detras de los papeles de panama  preguntadeldia otro grupo de migrantes cubanos varado entre costa rica y panama que opinas – últimahora terremoto de sacude japon segun usgs  últimahora sismo de sacude japon cientos de inmigrantes cubanos ingresaron violentamente a costa rica  este cuadro podria valer millones y fue descubierto casi por casualidad en un at como el esmalte de uñas ayudo a mantener en secreto los papeles de panam razones por las que el barcelona fue eliminado de la champions dos años sin saber absolutamente nada de sus hijas hasta ahor los warriors baten el record de victorias en la nba se va como leyenda kobe bryant anota puntos en su partido de desped te imaginas hacer obras en tu casa y hallar un cuadro valorado en millones pues esto paso en fr hillary clinton quiere una oficina de asuntos de inmigr los mas espectaculares edificios que nunca constru virus del zika estara bien este beb jets rusos realizan maniobras de vuelo cerca de un buque de guerra estadounidens hallan un posible caravaggio valorado en millones de dolares en un atico de fr dos años sin saber nada de sus hijas secuestradas por boko haram en nigeria hasta ahor el papel que jugo un esmalte de uñas en la filtracion de panam jets rusos realizan agresivas maniobras de vuelo cerca de un buque de guerra de ee uu como te transforma un ataque de ansied dos años sin saber nada de sus hijas secuestradas por boko haram hasta ahor las etapas que debes pasar para sobrevivir al desamor como un esmalte de uñas ayudo a mantener en secreto los papelespanam se despide como leyenda kobe bryant anota puntos en su ultimo jueg los warriors rompen el record de victorias en la nba por que el barça fue eliminado de la champions aqui razon como el esmalte de uñas ayudo a mantener en secreto los papelespanam dos años sin saber absolutamente nada de sus hijas hasta ahor virus del zika estara bien este beb hace dos años boko haram secuestro a las niñas de chibok sus padres no han sabido nada hasta ahor razones por las que el barça fue eliminado de la champions los mas grandes y espectaculares edificios que nunca constru un peruano ciego conmueve a nicky jam con su imit segun la ciencia hay cuatro tipos de borracho de que tipo eres tu alejandro garcia padilla hay una crisis humanitaria en puerto r tribunal de china rechaza demanda sobre matrimonio entre homosexual conclucubanos migrante el gobierno de ee uu les abre los brazos a los cubanos — patrocinado por glte de clar si te la perdiste mira la entrevista de con la procuradora de panama kenia porcell este viejo avion es un autentico heroe de la nasa segun la ciencia hay cuatro tipos de borracho de que tipo eres tu  descubrel un domo gigante sobre manhattan los mas espectaculares edificios que nunca constru vivanco es dificil que expertos cooperen con gobierno que no ha dado muestra de interes — concludesaparecidos vivanco en esta investigacion ocurrieron vicios muy graves de parte de las autoridades — concludesaparecidos vivanco lamentablemente la practica en mexico es que nadie rinde cuentas — concludesaparecidos vivanco todas las evidencias sugieren que en el caso ayotzinapa hubo un montaje — concludesaparecidos cual es tu cancion favorita de mariano mor argentina llora la muerte de la leyenda del tango mariano mor vivanco cidh tiene la decision final y eso no lo quiere comprender gobierno de mexico— concludesaparecidos jose miguel vivanco aqui hay problemas politicos y juridicos — concludesaparecidos pavel fernandez para los cubanos el acercamiento de ee uu con cuba es muy a largo plazo — conclucubanos pavel fernandez el gobierno de ee uu le abre los brazos a los cubanos — conclucubanos pavel fernandez creemos que ee uu nos va a dar la acogida que no nos va dar el gobierno panameño — conclucubanos pavel fernandez no queremos quedarnos en costa rica y tampoco en panama — conclucubanos pavel fernandez a nombre de los cubanos en panama pedimos disculpas al gobierno de costa rica — conclucubanos robert downey jr de ironman a conejito por qu hoy conclusiones analiza la crisis de cubanos en centroamerica participa con conclucubanos — patrocinado por glte de clar ted cruz donald trump no quiere hablar sobre los problemas familiacruz ted cruz no es aceptable atacar a la esposa o a los hijos de nadie familiacruz el chapulpo inky logro un escape de pelicula a traves de una tuberia en un acuari esto le que realmente le pasa a tu cerebro cuando consumes lsd y nunca te habian cont heidi cruz nuestro niños estan emocionados de ser parte de la campaña familiacruz ted cruz marco rubio me inspiro familiacruz ted cruz es grotesco tener una campaña en la que se amenace a los votantes familiacruz cruz el equipo de trump son como sujetos en un curso de psicologia clinica familiacruz <U+653C><U+3E64><U+613C><U+3E30><U+623C><U+3E64><U+653C><U+3E64><U+623C><U+3E33><U+623C><U+3E61> cruz trump se queja de las reglas porque esta perdiendo en las encuestas familiacruz trump una linda familia una fea campaña opinión",12701168
"2","Diario El Pais UY","humanidades investigan la empresa fundada por gavazzo y silveira   por que hay cada vez mas niños desobedientes   laura marling una cantante exquisita paso por la ciudad   video los aliados abandonan a a su suerte brasil   declaro ante la justicia y juega a ser una lider perseguida argentina   fallecio mariano mores el ultimo gran maestro del tango   lo han elegido tres veces que cree que la gente ve en usted   vidalin en encuentrosep <U+25BA> el peyote asesino una banda para la que veinte años no parecen nada   camara del libro la ley fotocopia es inconstitucional   con mamelucos y pelucas salian a robar llantas la policia los atrapo   varias actividades por el dia mundial de la bicicleta este fin de semana   salto tres semanas sin clases por rotura de un omnibus   los taxis vuelven a trabajar por las noches hubo acuerdo con la imm  servicios de la intendencia de montevideo afectados hoy por una asalmblea de adeom   jardin urbano cuando es conveniente pintar   crean un uber por y para las mujeres eeuu   brigadas del pit cnt se manifestaran en los negocios que suban los precios   dramatica crisis de la salud en venezuela faltan medicamentos y materiales medicos   una oferta en twitter de nuevas funciones en whatsapp es una estafa   bomberos explico el operativo fallido en un caso de suicidio   la suprema corte destituye a un juez por acoso y abuso de autoridad   los obama esa familia mediatica y presidencial   el gobierno apuesta a frenar la reincidencia en delitos graves   el lado positivo de ser madre a los   fotos una exposicion reproduce joyas arquitectonicas perdidas de montevideo   salinas robaron por quinta vez a una escuela en apenas dos semanas   el frente amplio exige una ley que obligue a justificar los despidos  el plan ceibal cruzara datos para detectar a los malos estudiantes   la iglesia pide perdon por los casos de abuso en uruguay   mira como estara el transito en montevide como estara el tiempo hoy   los obama esa familia mediatica ademas de presidencial video abreboca sabor de venezuela en montevide salud el lado positivo de ser madre a los añ fotogalería exposicion reproduce joyas arquitectonicas perdidas de montevide inseguridad salinas roban por quinta vez a una escuela en apenas dos seman normativa laboral fa exige ley que obligue a justificar los desp educación publica plan ceibal cruzara datos para detectar a malos estudi promete transparencia la iglesia catolica pide perdon por los casos de abuso en uruguay según estudio de puestos corren riesgo de automatizarse y desaparec cinco escenas para celebrar el dia internacional del bes interactivo el discurso de regreso de cristina fernandez en fr fotogalería y video asi le quedo el ojo a godin tras el choque con suarez comunicado iglesia catolica pide perdon a las victimas de abusos sexual josé luis rodríguez si interior da garantias nacional juega en el estadio de peñarol allanamientos bordaberry presento un proyecto para cambiar la constitu la ruta del dinero k excarcelaron a leonardo fariña y quedo con custodi paysandú scj destituye a juez por abuso de autoridad y ac fallo judicial exmilitar fue a prision por reiterados delitos de privacion de libert ya se juega el deoro seguilo en vivo aqui <U+25BA>    ad video un deportista graba cuando es derribado por un tiburon  bonomi larrañaga y bordaberry hicieron propuestas lacalle pou no   senado aprobo proyecto de ley que habilita fotocopiado de libros pasa a diput acusan a un exrecluso de guantanamo de querer robar a su hija recien nacida   cayo el presunto autor del crimen de la pareja paraguaya   excarcelaron a leonardo fariña y quedo bajo custodia judicial  el dolar subio al publico pero bajo entre banc director de aduanas ninguna frontera es inviolable  ",347907
"3","El Observador","en este informe de otv repasa la formacion y trayectoria del reconocido artista uruguayo pablo atchugarry el presidente de argentina y su vice cuestionaron a su antecesora cristin mira las primeras imagenes del backstage de la pelicula que protagonizara la uruguaya natalia oreir aceptaron el planteo de la imm se descartaran los vehiculos pequeños y deberan incorporar aire acondicionado   el prosecretario de presidencia dijo que la virulencia hace trabajar con incomod ahora en primeralectura con la columna de cine   lovienelobserv laura bardier nos cuenta las novedades de la proxima edicion de lovienelobserv pablo atchugarry hizo sus primeros pasos como escultor en europa mira el video completo  el decano de ccee insto a colaborar con los que toman riesgos en apertura de congreso internacional ahora en primeralectura mariano lopez entrevista a antonio vallverdu presidente del centro de talleristas lovienelobservador otv directores como ken loach jim jarmusch paul verhoeven o pedro almodovar competiran por la palma de or ya estamos al aire con y su columna de actualidad primeralectura miralo por como entender los bajos precios del petroleo por ramon espinas el juez fue destituido por haber sido denunciado por una expareja por supuestas situaciones de ac los delincuentes no son solamente los violentos toda la sociedad esta mas violenta dijo ricardo perez nuevo jefe de policia de mde los ultimos año hemos hecho un gran esfuerzo por mejorar y hemos mejorado ricardo perez nuevo jefe de policia de mdeo otv dijo ricardo perez la seguridad es dificil en cualquier pais y para cualquier policia primeralectura envivo por el filme de condorito se estrenara en america latina en octubre d el vicepresidente insto a la oposicion a presentar los informes sobre la investig ahora mariano lopez entrevista a ricardo perez nuevo jefe de policia de montevideo por presidencia destaco la implementacion de la ley de alcohol cero   tecnicos no descartan que se trate del abril mas lluvioso de acuerdo a los registros de inumet   ahora en primeralectura contacto telefonico con desde argentina nos cuenta sobre las declaraciones de la ex presidenta argentin por unanimidad el senado aprobo excepciones a la ley de derecho de autor ya venimos con las noticias en primeralectura envivo por abrieron investigacion tras declaracion de fariña en argentin cada vez que alguien sube una foto a una red social deja un rastro de datos del lugar en el que estuv la opp señalo que los organos nacionales son mas eficientes para cobr la capital sanducera es un ejemplo del exceso de precipitaciones   indicadores laborales continuaron su deterioro en el segundo mes del añ la obsesion por mejorar constantemente no deja quedarse quietos a los fundadores de pedidos ya via   la pelicula de oreiro se estrenara entre el y el de setiembre en simultaneo en argentina y uruguay   temer sabe que sus chances de convertirse en el nuevo jefe de estado brasileño son importantes  la empresa que transfirio us millones explico al banco que el giro fue para comprar terreno en punta del este   otro de los abusos relatados por santo y seña es el de un hombre que denuncia que un cura abuso de el   esta semana el ejecutivo quedo enfrentado a la mayoria de la bancada de diputados del fa  perdieron los partidos restantes convirtiendo tantos y recibiendo via   su argumento es que es victima de una persecucion organizada por el gobierno y con ayuda de la justicia   los principales titulares de este jueves  vtv habia descartado usar la señal pero la diaria y demos querian postergacion  gas sayago podra asignar o reservar servicios de forma preferente para ute y ancap  vazquez convoco a todos los actores del sistema politico y judicial a adoptar medidas para salir de este camino   cotizacion dolar la compra la venta euro y la venta peso argentino y real y hoy habra neblina sensacion termica c temperatura actual en montevideo c humedad mire el pronost los principales indicadores del mercado laboral muestran un deterioro respecto al año pas el senado voto el proyecto que despenaliza la reproduccion de text el discurso de cristina fernandez estuvo plagado de llamados a la accion y criticas a sus adversarios polit el de los empleos en uruguay corren riesgo de robotizarse en la proxima decada por es sabido que la ingesta de agua es necesaria para vivir con salud pero bebemos lo suficient marzo fue un mes rojo para los taxistas porque tras dias de paro facturaron un menos en montevide los cuatro detenidos tras el casting en el radisson por posible estafa fueron liberados por falta de prueb algunos virus tuvieron un papel importante en la manera en que los humanos se relacionan segun estudi una nueva estafa invita al usuario a habilitar una falsa funcion de videollamadas en whatsapp el militar retirado asencio lucero fue imputado por reiterados delitos de privacion de libertad durante dictadur tecnicos no descartan que se trate del abril mas lluvioso de acuerdo a los registros de inumet las nuevas alarmas de la tienda zara cuentan con un chip que brinda valiosa informacion a la compañ el estudio pone fin a meses de debates e incertidumbres sobre la vinculacion entre el zika y la microcefali cada vez que alguien sube una foto a una red social deja un rastro de datos del lugar en el que estuv poder ejecutivo impulsa proyecto que penaliza robo de ganado pero lo rechazan gran parte de los legisl el precio promedio del billete verde se situo hoy  desde casablanca hasta secreto en la montaña algunos romances hicieron historia cinematograf pedi todos los sabados con el observador cocina en familia fasciculos con recetas caseras y salud iglesia catolica califica los abusos sexuales cometidos por sacerdotes uruguayos como aberrantes y pide perdon las cinco noticias que debe saber antes de llegar a casa por cansada de la adiccion de sus hijos al celular la mujer destruyo sus moviles de un escopetazo mira el video ac leonardo fariña el valijero de la ruta del dinero k pasara a cumplir prision domiciliari",358523
"4","El Espectador","copalibertadores y con grito oriental sendic si oposicion no presenta denuncia el mismo ira a la justicia  pego primer abre la puerta a los robots interact gobierno plantea quitar libertad anticipada a reincidentes de delitos graves  vs duelo aparte dentro de la canch conozca la tecnica para recordar las cosas de manera mas eficaz escuela de salinas quiere que vuelva la guardia de segur por que experimentamos episodios de dejà vu estudio de damiani presuntamente involucrado con dinero k   <U+653C><U+3E64><U+613C><U+3E30><U+623C><U+3E63><U+653C><U+3E64><U+623C><U+3E66><U+383C><U+3E30> se retiro a lo grande kobeday iran presenta armamento capaz de enfrentar una guerra nucl abre la puerta a los robots interact conozca la tecnica para recordar de manera mas eficaz por que experimentamos episodios de dejà vu asi estara el tiempo en montevide sendic si oposicion no presenta denuncia el mismo ira a la justicia  estudio de damiani presuntamente involucrado con dinero k   gobierno plantea quitar libertad anticipada a reincidentes de delitos graves  luego de tres matrimonios fallidos jennifer lopez todavia cree en el cas elton john negocia su actuacion en secuela norteamerican psicologo explico a madonna como debe tratar a su hij alas uruguay tiene problemas financieros de corto plazo gestiona financiacion  leonardo dicaprio producira junto a paramount pictures un filme sobre mafia cuban fmi preve crecimiento de para este año y para   en confirma continuidad de bonomi y anuncia proxima reunion muere el compositor y pianista argentino mariano mores una leyenda del tang conozca al niño que supera el coeficiente intelectual de stephenhawking y einstein buscaron la ruta del dinero k y encontraron la ruta del dinero m director de aduanas ve contradictorias versiones de fariñ tenis perdio en montecarlo y es sorpres lola moreira competira en mexico pensando en rio de janeiro  descubren como reacciona el cerebro de los matemat cuanto costara a partir de may interactivo conozca la ley que legaliza el fotocopiado de libr cayo ante en el masters montec sendic decidio encabezar lista en elecciones internas del fa  muere el compositor y pianista argentino mariano mores una leyenda del tang consiguen firmas para que bocca no deje el sodre  el desempleo aumento a en febrero <U+2192> llega a uruguay el festival en el que la basura se vuelve arte  <U+2192> senado voto proyecto que habilita fotocopiar libros para estudiar  <U+2192> alas uruguay tiene problemas financieros de corto plazo gestiona financiacion  guardiola gano la batalla el bayern paso a semis  <U+2192> lea lo que le dijo cristina fernandez a la justicia sobre el dolar futuro    asi le quedo el ojo a godin tras el codazo de suarez  mira la <U+653C><U+3E64><U+613C><U+3E30><U+623C><U+3E64><U+653C><U+3E64><U+623C><U+3E33><U+623C><U+3E37> <U+2192> masiva concentracion por la paz de la comunidad armenia  <U+2192> psicologo explico a madonna como debe tratar a su hij iglesia catolica pide perdon a victimas de abusos  <U+2192> elton john negocia su actuacion en secuela norteamerican montevideo refrescos planea despedir al de su plantilla  justicia argentina decidio excarcelar a leonardo fariña  <U+2192> el atletico logro dejar afuera al barcelona  <U+2192> tenis perdio en montecarlo y es sorpres lola moreira competira en mexico pensando en rio de janeiro  sendic decidio encabezar lista en elecciones internas del fa  asi le quedo el ojo a godin tras el codazo de suarez  mira la <U+653C><U+3E64><U+613C><U+3E30><U+623C><U+3E64><U+653C><U+3E64><U+623C><U+3E33><U+623C><U+3E37> <U+2192> cuanto costara a partir de may interactivo conozca la ley que legaliza el fotocopiado de libr leonardo dicaprio producira junto a paramount pictures un filme sobre mafia cuban fmi preve crecimiento de para este año y para   bomberos explica procedimiento en caso de intento de autoeliminacion <U+2192> en confirma continuidad de bonomi y anuncia proxima reunion conozca al niño que supera el coeficiente intelectual de stephenhawking y einstein consiguen firmas para que bocca no deje el sodre  director de aduanas ve contradictorias versiones de fariñ descubren como reacciona el cerebro de los matemat cayo ante en el masters montec buscaron la ruta del dinero k y encontraron la ruta del dinero m alas uruguay tiene problemas financieros de corto plazo gestiona financiacion ",168596
"5","El Caribe","tribunal de san pedro dicta años de prision a dos por diferentes delit inicia jornada de vacunacion contra el polio gt gt gt gt gt gt salud inicia jornada de vacunacion contra el poli faustomata se diversifica en el entretenimiento elcaribe entretenimietnocaribe gent faustomata se diversifica en el entretenimiento gt gt gt por fogarate  frases presidenciales por ramon colombo   opinion  dan de que hablar    condenan a años hombre que violo de su hijo de años gt gt gt hombre ahorca a sus dos hijos y luego se suicida en los mina gt gt gt gt habra en las proximas elecciones una segunda vuelta en el nivel presidencial entre y vote en la encuesta del dia accesando a su opinion es import hombre ahorca a sus dos hijos y luego se suicida en los min hombre ahorca a sus dos hijos y luego se suicida en los min josebautista llega a las remolcadas franco la saca gt gt gt jose bautista llega a las remolcadas franco la sac mujer hiere a otra a cuchilladas durante discusion en sector de puerto plat mujer hiere a otra a cuchilladas durante discusion en sector de puerto plat fuerte sismo sacude japon todos despiden a kobe bryant magic lo nombra el mejor lak fuerte sismo sacude japon fuerte sismo sacude japon fuerte sismo sacude japon mauricio gana y toma el control ante los pr mauricio gana y toma el control ante lospr el zika si produce malformaciones en bebes el zika si produce malformaciones en bebes todos despiden a kobe bryant magic lo nombra el mejor lak todos despiden a kobe bryant magic lo nombra el mejor lak rd y haiti trabajan en retomar dialog elcaribe caricatura humor años acompañandote cada dia en la busqueda de verdaderas y nuevas respuestas elcarib elcaribe te presenta la frase correspondiente a este de abril del años acompañandote cada dia en la busqueda de verdaderas y nuevas respuestas elcarib danilo felicita a elcaribe por los años de su fund gobierno y medicos frente a frente hoy guillermo moreno “las condiciones estan dadas para una segunda vuelta” leonel en las calles a quien realmente le hace campañ eeuu confirma que el zika si produce malformaciones en bebes “el periodismo es una pasion insaciable que solo puede digerirse y humanizarse por su confrontacion descarn buenos dias compartimos con ustedes nuestra portada de este de abril de correspondiente a nuestr publique una nueva foto en facebook criollo maikel franco pega jonron y carga a filis en victoria ante padr aquilino serrata realiza mano a mano en las palmas de herrer anuncian “cumbre mundial de comunicacion politica” impartiran diplomado en ciencias auxiliares de la histori",464764
