"","userNames","userTweets","followers"
"63","CuyoNoticias","situacion en paso cristoredentor cerrado mira las fotos d lascuevas arg y libertadores chi by terremoto earthquake y llega a general alvear la idea de la “heladera social” el debut de un mendocino leyenda del futbol victor legrotagli paso cristoredentor cerrado rn r chile el pronostico promete nevadas cc esta abierto el pas esta basura esta en el accesoeste frente a terminal omnibus mendoz   ordoñez del gremio judicial al criticar la acordada del horario vespertino en fuero penal muestra q son insensibles a la realidad mendoz mendoz caso romina aguilar “todo esto es por culpa de la maldita herencia” perdio maipu en san ju interesante nota d en sobre llegada de a argentina tiene aviones y transporta millones pasajeros añ federal a gimnasia derroto a gutierrez a  argentin vienen a mendoza hay alguna fech abusaron de una chica de años que fue abordada en la terminal de tunuyan alejandro slokar el responsable de dejar la seguridad en manos de la campor ‘que dijo la periodista marina walker en solo un cafe’ on soundcloud np comenzaron las “cosechas gratuitas” de citricos para evitar la propagacion de la mosca del mediterrane cc “veladero esta construida sobre ambiente periglaciar” censuraalaprens tiger woods el golfista mas joven que fue campeon",12905
"64","Clarín.com","el responsable de la seguridad de comodoro py busco despegarse de la campor lali hot desde miami el desafio de ser coherentes y flex video delata a una mujer que robo un anillo de un cadaver en una funerari proponen crear un parque nacional en la reserva faro querand asi vuelcan desechos cloacales al nahuel huapi gianinna y su momento mas duro de crecer con maradon maduro presenta pruebas de una conspiracion imperial confirman que uno de los detenidos por el crimen de melanie tenia antecedentes por abus se derrumbo un edificio en tenerife buscan desaparec para macri el acto de cristina en tribunales fue desafortun massa scioli carrio randazzo se largo la carrera por el sen vidal anuncia un paquete social para amortiguar los ajust bafici peliculas de continent aerolineas y lan sumaron mas de vuelos por seman ficcion a la mexican las posiciones de la libert un estafador preso a todo lujo hacia asados en la comis putin invito a macri a moscu para el mundial de futbol a bonadio no le molestan los cantitos peron la justicia ordeno frenar a uber y hacen multas de hasta mil dolar futuro cristina no contesto preguntas y solo entrego un escrito polit karina jelinek revelo el contenido de la carta que le envio fariñ cristina volvio con un discurso para la militancia con duras criticas a macri el piquetero luis d elia rodeado de manifestantes que lo apoyaron estuvo presente en el acto de cristina kirchn tienen y años y los acusan de asaltar y estrangular a un jubil los argumentos que usaria bonadio para procesar a cristin macri le acepto la renuncia a oyarbid macri se mostro con urtubey y busco contrastar la imagen de tribunal michetti lo que paso en la puerta de comodoro py fue lament un viaje con bastantes dud cientos de pueblos aislados por la inundacion en el litoral el ex banquero español mario conde a la carcel por corrupcion los confirmados para bail refugiados en botes inflables en busca del sueño en el reino un choriparnero a las de la mañana en comodoro py pachano lo de cristina kirchner fue una mamarrachada mas una noche en lancha para salvar a refugiados frente a la isla de lesb triaca anuncio que se convocara al consejo del salari consejo del artista mas caro del mundo hay que cruzar los limit antonio banderas cumplio su sueño argentin impactante denuncia de un ex funcionario contra un intendente de la campor cual fue la excusa de cristina para no contestarle pregunta a bonadi una patota ingreso en el indec y causo destroz manifestantes protestaron contra cristina en el obelisc la columna de moreno presente en el acto de cristina en comodoro py el intendente grindetti hablo de su empresa off shor los que llegaron tard dady es del pueblo caraj votar antes seria “una violacion constitucional” koblic sobre antiheroes y tumb exilio de malvinas la otra campan el ex intendente de la calera apunto contra su rival politico por el crimen de su muj exigen a maduro que presente su partida de nac excarcelaron a leonardo fariñ bafici espiritu independient escandalo en neuquen padres se cruzaron en una escuela por una denuncia de abus dijo que habia arrollado y arrastrado a un motociclista pero habia sido su hij oyarbide cerca del bail dilma propone un pacto para adelantar las eleccion mañana no habra bancos por un paro de los empl guillermo moreno aparecio en medio de los incidentes en comodoro py grave brote de gastroenterocolitis en berazategui suspenden las clases en escuel le robaron el auto y desvalijaron su casa todo en la misma noch la justicia de rio ordena investigar posible corrupcion en las obras olimp desde salta macri evito cruzarse con cristina y hubo mimos con urtubey el intendente k que les dio el dia a los municipales para ir al acto de cristin las frases mas picantes de cristina kirchn toma en el nacional buenos aires en reclamo por los alumnos libr mercedes ninci fue golpeada por militantes de la campor",2176699
"65","LaIguanaTV","foto alarmante precio del atun en lata sigue subiendo sin control y usuarios chill default venezuela ya ha pagado mil millones de dolares de capital y de deud decomisan toneladas de arroz que iban a ser bachaqueadas a supermercados fot a de comandante chavez activo un nuevo ciclo politico tras golpe en su contr sundde llego a comercios del este de caracas y con esto se encontro imag cierre de abastos bicentenario en varias partes del pais aca lo que dicen trabaj realidad total los ingresos de divisas a venezuela disminuyeron detall fotos aeropuerto capriles se fue nuevamente a nueva york y volvera en esta fech la tasa simadi alcanzo los bolivar en fotos asi fue controlado incendio en el parque la llovizna boliv planilla julio borges dijo los pasos que faltan para activar revocatorio contra madur tras investigacion lea el contundente mensaje de maradona a cristina fernandez via facebook aqui le decimos como obtener un punto de venta para su negocio pas imagen “panfletos de la muerte” amenazan al norte de maracaibo grupo extermini sundde llego a comercios del este de caracas y con esto se encontro imag el video que publico peligroso choro exigiendole esto a las autoridades antes de s juzgan en miami a este exactor de sabado gigante por pornografia infantil fot video leopoldo lopez se estrena en los simpsons diputado diosdado relato lo ocurrido en la profanacion de la tumba de sus familiar conozca uno a uno los activos de empresas polar aca en venezuela y en el mund lo que dijo maduro sobre comparecencia de hector navarro en an sepa que paso con visas de visitante en la embajada de ee uu en venezuel fotos vea como el pueblo salio a las calles el a para exigir el regreso de chavez peligroso the washington post pide desesperadamente una intervencion para venezuel foto tuit este hampon salio de la carcel y esta armando “mega banda” para mat hermann escarra aclaro rumores sobre cheque de millones desde banco de miraflor pronostico jueves de lluvias dispersas hacia el sur andes y oriente del pais inameh en fotos asi fue controlado incendio en el parque la llovizna boliv planilla julio borges dijo los pasos que faltan para activar revocatorio contra madur tras investigacion lea el contundente mensaje de maradona a cristina fernandez via facebook fotos “si no llueve y no damos respuesta muchos hermanos van a sufrir inclu las fotos de la momia de años vestida con ropa lujosa que revientan las red anuncio maduro ya esta lista enmienda para acortar periodo de la asamblea nacional video candela mire como la sundee acabo con colas y bachaqueo en supermerc golpe de estado por goteo freddy bernal lanzo alerta sobre venezuel video leopoldo lopez se estrena en los simpsons juzgan en miami a este exactor de sabado gigante por pornografia infantil fot asi llego hector navarro a la an para hablar sobre denuncias fot el video que publico peligroso choro exigiendole esto a las autoridades antes de s marido esta implicado en asesinato de maestra embarazada en zulia fot asi se fregaron bachaqueros y acaparadores en catia mujer a punto de llorar los denunci guri alcanzo por da vez cota minima historica y esta cerquita de “zona de colapso” video leopoldo lopez se estrena en los simpsons conozca cual es la cura del bachaqueo y la corrupcion segun madur roba quintas mueren al intentar detonar granada contra la policia detall video descaro vea como bachaqueros venden medicinas y alimentos bien caros en este merc el comunicado de la asamblea del chavismo en rebelion ante el congreso de la patri meten presos a hombres por asesinato del alcalde del municipio la ceib el video que publico peligroso choro exigiendole esto a las autoridades antes de s la foto detienen a una mujer que torturo con electricidad y golpes a su hija en zuli corrupcion es un acto contra el socialismo navarro denuncia desfalco de mil juzgan en miami a este exactor de sabado gigante por pornografia infantil fot estos son los campamentos paramilitares que descubrio la olp en barlovento fotos se atreveran la oposicion llama a una nueva movilizacion el de abril vide buscaban el dinero k y encontraron el dinero m contundentes palabras de cristina al juez director del foro penal venezolano fichado en los papeles de panam el parao de maduro a the washington post por pedir intervencion extranjera en venezuel por que ee uu no esta en panama papers un grupo de periodistas filtr presidente maduro denuncia cerco financiero internacional contra venezuela deuda acusan a estos chanchulleros de mercal tras ser detenidos en varg video indignante de una profesora cuando golpea y se burla de su alumno deten vea lujoso apartamento que se gasta tesorero de capriles radonski en miami corrupción venezuela ya entrego a la onu la sentencia del tsj que declara inconstitucional ley d pronostico jueves de lluvias dispersas hacia el sur andes y oriente del pais inameh director del foro penal venezolano fichado en los papeles de panam fotos “si no llueve y no damos respuesta muchos hermanos van a sufrir inclu conozca uno a uno los activos de empresas polar aca en venezuela y en el mund las fotos de la momia de años vestida con ropa lujosa que revientan las red lo que dijo maduro sobre comparecencia de hector navarro en an estas son las portadas y titulares de los diarios de este jueves de abril d",550663
"66","teleSUR TV","últimominuto otro fuerte terremoto sacude el sur japon el segundo en un dia v conozca las frases mas contundentes durante la defensa de todosconcristina en tribunal americalatina movimientos colombo venezolanos conformaran frente fronteriz siguenos en livestation y no le pierdas la pista a la mejor program onu envia expertos a paraguay por intensas lluvi denuncia campaña promovida por la oposicion a favor del juicio politico brasil españa multan al expresidente jose maria aznar por irregularidades fiscal blogstelesur por convirtieron a panama en paraiso narcofiscal argentina muere la leyenda del tango mariano mor las mas altas cupulas de un imperio decadente conspiran contra venezuel blogstelesur por la violencia contra el mst no te pierdas este viernes a las h ven misterios de la historia con solo web biblioteca nacional de colombia inaugura la gaboteca este juev no te pierdas este viernes a las h ven misterios de la historia con solo web blogstelesur por abrir una ventana para concluir con los rep fiscalia de panama no tomara ninguna medida contra mossack fonseca por caso panamapapers panamapapers revela millones de documentos filtrados de la compañia mossack fonsec quien mas esta implicado en los papeles de panama se deben difundir todoslospanamapapers argentina mantendra relaciones con rusia segun canciller malcorr españa arranca huelga de estudiantes contra la lomce y el decret análisis ay jose como te extrañamos en estas revueltas joserevuelt banca publica y privada de paro en argentina en contra de los despidos mas presidente de bolivia llega hoy al vaticano para reunirse con conoce todo lo que dijo el presidente de rusia en la conferencia linea abierta con putin todoslospanamapapers enterate como se convierte un pais en un paraiso fiscal siria se incorporara a las conversaciones de paz en ginebr argentina catalogan como embestida judicial investigaciones contr nuevo boletin de resultados de las eleccionesperu dan mas votos a fujimori y mendoz colombia capturan a miembros del clan úsug movimientos sociales del mundo exigen justiciaya por el asesinato de bertacacer implicacion en panamapapers de david cameron reduce puntos de popularidad en uk opep es necesario reducir inventarios para incrementar la cotizacion del crud crisis capitalista centro del debate en encuentro mirelo via streaming inicia nueva ronda de negociaciones de paz para siria en ginebr alerta volcan de fuego entra en erupcion en guatemal venezuela hallan campamentos paramilitares en el estado mirand ya nos sigues en livestation sumate a nuestra comun partido comunista de cuba analizara crecimiento economico de la isla durante congres entra a nuestra señal envivo de youtube y enterate de las noticias mas relevantes del mund todoslospanamapapers son legales los paraisos fiscal cuales son los pasos para un impeachment o juicio politico contra en brasil convocan movilizaciones frente a embajadas de brasil en respaldo  envideo y sus triunfos frente a los ataques de la derecha en venezuel por que no hay ninguna empresa de eeuu implicada en los panamapapers siteloperdiste captura infraganti con los fondos buitre en argentin presidente putin descarta implicacion politica en caso de dopaje con meldonium rusi como se han beneficiado los venezolanos con los convenios internacionales te lo mostr tambien estamos envivo por livestation no dejes de segu estos son los resultados de los cuartos de final de la ligadecampeon maradona asegura que hoy se siente mas cristinista y justicialista que nunc arranca conteo de votos en siria tras larga jornada electoral manifestaciones antigubernamentales en macedonia culminaron con enfrent no te pierdas este viernes a las h ven misterios de la historia con solo web salud confirman relacion entre el zika y la microcefalia en fet",1153283
"67","VTV CANAL 8","videovtv gobierno bolivariano impulsa el motor export años de su mandato cuenten con este servidor para la etapa de la revolucion bolivarian presidente intercede por venezuela ante la onu ahora pueblo se moviliza en apoyo a la gmvv como pasar de una economia rentista dependiente a una economia productiva export en video conversatorio de una historia insurgente de abril de fot hoy el pueblo marcha en defensa de la gmvv conoce los puntos de encuentr intervtv presidente evo morales llega este jueves al vatican diputado jaua se une a red social facebook para mayor acercamiento con el puebl maduro congreso de la patria derrotara pretensiones golpistas de la an adeco burgues portadas de diarios nacionales y regionales de este juev analista maduro ha resistido con heroismo el asedio internacional durante estos añ hasta el de abril seran las preinscripciones en la unes en tres años de gobierno de nos hemos enfrentado a una guerra no convencional y hemos resist presidente rechaza injerencia del imperio mediante el washington post ahora analista jose ávila  olp se despliega en el estado carabobo con mas de funcionarios este jueves fot ahora inicia con y olp se despliega en el estado carabobo este jueves fot en la mud “no tenian idea” de lo que se iba a tratar en la comision por la verd inameh pronostica este jueves lluvias dispersas hacia el sur andes y oriente del p opinionvtv por el negocio del crimen organizado y el pranato iii con el mazo dando las patas de gallina hicieron salir corriendo a capriles del p conatel inicio registro y actualizacion de medios comunitarios y altern pdte llama al congreso de la patria a generar propuestas para mejorar desarrollo del p <U+25B6> maria corina le responde a diosdado que de pana si le ‘gusta el chicharron’ freddy guevara trajo el dinero para las guarimb ninguna de las opciones que ha presentado la derecha tiene viabilidad politica en venezuel envivo celebrando los años del gobierno del presidente maduro comienza cantar de gallos con recorre en fotos una gestion por los humildes gobierno de presidente maduro cumple añ intervtv propone frente ciudadano contra politicas neoliberales de macri video a años del golpe de estado ee uu mantiene su agresion contra el p envideo aznar vuelve a arremeter contra venezuela lo importante es la salida de madur dilma asegura que luchara hasta hacer fracasar la tentativa del golp esta es la ruta pueblo venezolano marcha este jueves contra la ley de estaf encuentran estructura paramilitar en el estado miranda fot diosdado cabello denuncio ataque contra jesse chacon y su persona vide tres años de firmeza obrera y chavista —ataques no han destruido la fidelidad de un lider… mas de mil fiscalizaciones realizo la sundde durante primer trimestre d te enseñamos como hacer un banco de semill intervtv cfk me pueden meter presa pero no me van a call avictoriapatriota recordando al comandante canciones de abrilrebelde escúchalas <U+25BA> golpe de estado de fue un ensayo para llegar a personas cercanas a chavez vide video a años del golpe de estado ee uu mantiene su agresion contra el p envideo aznar vuelve a arremeter contra venezuela “lo importante es la salida de maduro” min marcano “derecha venezolana esta dirigida por cobardes acostumbrados a crear caos” ahora repase las informaciones del dia en minutos en la noticia con enfotos vi aniversario de la milicia nacional bolivarian en nicolas maduro es elegido presidente para continuar el legado de hugo chavez avictoriapatriota<U+25BA> queremos a chávez exigio el pueblo en las calles de venezuel presidente maduro la milicia bolivariana es la maxima moral combativa de la patri <U+25B6> primer presidente chavista cumple tres años de gobierno en favor de los mas humild bayern munich sella su pase a semis en un partido de muchos gol un efectivo griezmann deja afuera al vigente campeon de la champions leag pdte maduro a milicianos son la expresion concreta de la union civico militar del p video a años del golpe de estado ee uu mantiene su agresion contra el p frases de eduardo galeano que el mundo debe conoc ahora analiza con walter martinez los acontecimientos de nuestra querida contaminada y unica nave espacial <U+653C><U+3E64><U+613C><U+3E30><U+623C><U+3E63><U+653C><U+3E64><U+623C><U+3E63><U+383C><U+3E65> realizaran inventario a unidades de transporte inoperativas para abastec quieres ver nuestra programacion mas de cerca siguenos en snapchat para que sigas lo que hacemos vamos diputado jaua se une a red social facebook para mayor acercamiento con el puebl envideo aznar vuelve a arremeter contra venezuela “lo importante es la salida de maduro” en video conversatorio de una historia insurgente de abril de fot hasta el de abril seran las preinscripciones en la unes",1074824
"68","Venevision","mundoshow cual de ellos sera papa entra y enterat mundoshow conoce quien vestira a el dia de su bod el sonero de la juventud llega con lo mejor de la salsa este sabado  vidayestilo la verdad sobre la pastilla del dia despues mundoshow mira como se hizo el video de con mundoshow ben affleck dirigira su propia pelicula de batm felizjueves comienza un nuevo dia cargado de oportunidades para ser felices ya en sintonia d mundoshow desmiente los rumor mundoshow feliz dia del bes mundoshow fue hospitalizado conoce aqui el mot mundoshow asi se grabo el video de con vidayestilo todo sobre la pastilla del dia despues mundoshow descubre quien hara su propia version de batm mundoshow no se va a cas mundoshow celebra con quien amas el dia internacional del bes mundoshow sufre de cansanci mundoshow no te pierdas el making of de andas en mi cabez vidayestilo la verdad sobre la pastilla del dia despues mundoshow dirigira su propia pelicula de batm mundoshow desmienten que este compromet mundoshow celebra con quien amas el dia internacional del bes mundoshow fue hospitalizado por cansanci mundoshow asi se hizo andas en mi cabeza de con mundoshow asi se hizo andas en mi cabeza de con daddy yanke mundoshow celebra con quien amas el diainternacionaldelbes mundoshow fue hospitalizado por cansanci fotodeldia celebra el diainternacionaldelbes feliz diainternacionaldelbeso cuentanos con quien te gustaria pasar este dia <U+653C><U+3E64><U+613C><U+3E30><U+623C><U+3E64><U+653C><U+3E64><U+623C><U+3E32><U+383C><U+3E62> mundoshow desmienten que este compromet felizmiercoles hoy celebramos el diainternacionaldelbeso demostremos siempre el amor que sent mundoshow usara un vestido en su boda conoces quien lo diseñ mundoshow conoce aqui lo que celebra el ex rbd en las redes social mundoshow supero a y mundoshow esta famosa cantante sera madr mundoshow la prensa elige su favorita en miss mer mundoshow eres emprendedora esto te interes mundoshow conoce quien vestira a el dia de su bod mundoshow cual de ellos sera papa entra y enterat mundoshow obtuvo menciones en los billboard mundoshow conoce los detalles sobre la maternidad de aqu mundoshow miss merida presenta a su primera gan mundoshow las mujeres emprendedoras ya cuentan con el apoyo de cisneros e iesa mundoshow revelo quien la vestira el dia de su bod mundoshow un ex rbd se estrena como padr mundoshow arrasa en los billboard",2593248
