,userNames,userTweets
1,El Universal,opinión no lincharas a tu projimo por felix palazzi pagan seis mil millones de bolivares en subsidio de arroz maiz y cañ opinión por que le temen a la convivencia por felix corder la dura sobrevivencia del teatro universitari opinión los papeles de panama por carlos dor star wars el despertar de la fueza gana en los premios mtv cin dos parejas de gemelos chinos se casan y operan para evitar confundirse curi opinión la ley la politica y la economia por jose vicente rodriguez lucha por el segundo lugar marca elecciones presidenciales peruan opinión la casafuerte por jose felix diaz kipruto domino el maraton de roma atlet opinión institucion y salud por bartolome finizol impulsan desarrollo turistico en vargas con empresas socialistas venezuel opinión el pais vacio por luis vicente leon detienen a tres hampones que hurtaban en el colegio santa ana de el paraiso insegur aseguran que crisis electrica no es producto del fenomeno el niño  opinión plazos traicioneros por carlos raulñ hernandez marruecos acoge el rodaje de la nueva temporada de prison break a un paso de crear embriones resistentes al sida cient opinión no lincharas a tu projimo por felix palazzi casa cuna de los teques suma años escolariz opinión por que le temen a la convivencia por felix corder rodmar rodriguez hay ambulatorios activo y cuatro fuera de servicio en el sector la parrilla venezuel opinión los papeles de panama por carlos dor expediente obstaculos a los viajer opinión la ley la politica y la economia por jose vicente rodriguez emprendimiento venezolano obtiene el respaldo de google tecnolog opinión la casafuerte por jose felix diaz madres exigen rehabilitacion de la escuela andres bello en antimano venezuel rodmar rodriguez en odontologia se ha deteriorado la atencion por falta de insumos venezuel un nuevo troyano esta infectando correos electronicos tecnolog radiocut llega a venezuela para cambiar la forma de escuhar radi avisail garcia conecto jonron de tres carreras beisbol mlb unas familias estan en riesgo en nueva casarapa venezuel montaner confirmo en nueva york que lo mejor esta por venir mus arepas alemanas españolas y colombianas serviran en expogastronomia gastronomia venezuel historias de vida hernan diaz el universal ha sido el mejor postgrado que he hecho venezuel expediente venta de paquetes turisticos hacia venezuela ha caido en tur cadaveres han sido registrados en la morgue en abril inseguridad homicidi protestas contra reforma laboral en francia dejan heridos y deten real sociedad es la piedra en el zapato del barcelon banda flatt lonesome crea una version country del tema de juego de tron peru vota con la incertidumbre de quien disputara balotaje con fujimori mirada expuesta jorge luis santos garcia muestra los rostros de la fe fotografi haciendas antiguas ofrecen diversion venezuela carac nueva identidad grafica para el grupo pestana venezuel no basta con llenar una plantilla es necesario dedicarle tiempo a la red tecnolog opinión institucion y salud por bartolome finizol sociedades cientificas advierten que el pais vive una escasez inolcultable de medicament colegio mater salvatoris gana primer lugar en competencia britan
2,Noticias24,estas son las fotos mas cool del d banda los grillos fue desmantelada en merida detenidos a la orden del mp terroristas iban a repetir atentado en francia pero lo hicieron en brusel exdirector de el rodeo i fue acusado por facilitar armas y explosivos a los int conoce las playas de escocia que te haran pensar que estas en el carib sigue proceso electoral en peru para conocer quien disputara la segunda vuelta con fujimori en fotos la visita de kate y williams a zonas de extrema pobreza en la indi programa caracas rueda libre llego este domingo a su jorn mas de un centenar de muertos y heridos deja un incendio en la indi el gran actor carlos marquez y su ultima entrega a chejov un recuerdo inolvid receta del dia el delicioso lomito nocciolla de moises barri kylie brillo en rosa para la publicacion pap peruanos votaran hoy en venezuela en elecciones presidenciales de peru acusan a tres gerentes de conviasa por corrupcion los funcionarios estan deten van venezolanos clasificados a rio luis orta consiguio su boleto este doming deslumbrante asi lucio lindsay lohan en los premios de asi olp desmantelo dos bandas criminales en portugues dilma rousseff afrontara dos votaciones para impedir juicio polit implementan una cirugia exitosa contra el cancer de prostat el oriente de venezuela se siente a traves de sus platos mas tip mas de un centenar de muertos y heridos deja un incendio en la indi candidata keiko fujimori ejercio su derecho al voto en lim inauguran area de emergencia del hospital central de maracaibo invierten bs millon isturiz se reunio con productores agricolas del zulia para evaluar avanc de encuestados no confia en que la oposicion resuelva los problemas econom gobierno se solidariza con el pueblo de la india tras incendio en templo del koll faria indico que fue simplificado el de los tramites administrativos para export este domingo renuncio el primer ministro de ucrania arseni yatsenyuk quieres saber como el ejercicio cambia tu cerebr sigue proceso electoral en peru para conocer quien disputara la segunda vuelta con fujimori romina palmisano presenta su nuevo video en espectacul sinagoga argentina acoge primer matrimonio homosexual judio de latinoamer inicio la jornada nacional de siembra por la patria en el estado carabob conoce las playas de escocia que te haran pensar que estas en el carib de encuestados no confia en que la oposicion resuelva los problemas econom candidata keiko fujimori ejercio su derecho al voto en lim estas son las fotos mas cool del d en video mire la reaccion del publico de birmingham a adele tras un fallo de son dilma rousseff afrontara dos votaciones para impedir juicio polit receta del dia el delicioso lomito nocciolla de moises barri en fotos asi transcurre el proceso electoral en peru crees que el celular pueda hacer que pierdas a tu pareja conoce los detalles aqu jvr en el encuentro de obama y macri se hablo de venezuela y se fijaron accion fotos asi se vivio la jornada previa a los comicios que se llevaran a cabo este en peru inicio la jornada nacional de siembra por la patria en el estado carabob se ha ahorrado de energia con el decreto de los viernes como no laboral la historia viva del arte venezolano en dos recintos y metr humala ejercio su derecho al voto tenemos que romper el reto de la historia peruan farmacos genericos y estudios de bioequivalencia realmente import continua proceso electoral en peru para conocer quien disputara la segunda vuelta con fujimori
3,El Nacional,imputaron a cristina kirchner y julio de vido por lavado de diner ramos allup limpiamos la an de objetos de bruj sippuntacana luis almagro tendra derecho de palabra hoy en reunion de la sip observatorio venezolano de salud pidio a maduro aceptar ayuda internacional diario estadounidense muestra como seria el pais con trump como president foto james rodriguez fue capturado riendo a carcajadas mientras el madrid perd serena williams paralizo las redes sociales con una sesion de twerking gt solicitaran a la an destitucion de padrino lopez fotos allanan casa de dueño de narcoavioneta detenido en dominican sebin detuvo nuevamente a comisario victor hugo mora en tachir mho entrego carta a almagro explicando situacion de medios en venezuela sippuntacan maduro le consulto a raul castro si debia renunci solicitan que se declare a margarita en emergent ser pobre es muy duro son muchos los dias que dormimos sin com nuevos desafios de la democracia hemisferica con sippuntacan sippuntacana fotos venezolanos en la sip estamos eternamente agradecidos con la oea doctores dijeron que no me preocupara y meses despues me diagnosticaron cancer de mama por y soy violador y traigo drogas la campaña contra trump de gael garcia bernal y los cuaron elecciones peru ppk esperara resultados de la onpe con ilusion y mucha calm video publicaron trailer de la pelicula de édgar ramirez con robert de nir gerentes de conviasa son acusados por corrupcion fallecio el periodista guillermo vargas a los añ observatorio venezolano de salud pidio a maduro aceptar ayuda internacional asi estara conformada la lista de jugadores para la copaamericacentenario gt diario estadounidense muestra como seria el pais con trump como president pitbull y enrique iglesias estrenaron nueva cancion horoscopo adriana azzi revela que le deparan los astros esta seman elecciones peru keiko fujimori gano la primera vuelta electoral con mho entrego carta a almagro explicando situacion de medios en venezuela sippuntacan sebin detuvo nuevamente al comisario victor hugo mora en tachir fotos allanan casa de dueño de narcoavioneta detenido en dominican solicitaran a la an destitucion de padrino lopez el humilde apartamento donde vive campeona de la vinotinto femenina gt foto james rodriguez fue capturado riendo a carcajadas mientras el madrid perd conoce las vivencias que los llevaron al exito en la vicumbredeléxito de est ensevive te invita a disfrutar de la musica venezolana con estos grandes idolosdelllan corina smith se posiciona en el primer peldaño de la cartelera record report con “la dificil” capitan america civil war criticos adoran la pelicul conoce al actor que dara vida al psiquiatra de grey en cincuenta sombras mas oscur nuevos desafios de la democracia hemisferica con sippuntacan corpoelec aumenta racionamiento a horas en el interior del p documento medios deben recuperarse en pro de la democracia en el p imputaron a cristina kirchner y julio de vido  por lavado de diner ramos allup limpiamos la an de objetos de brujeria  sippuntacana almagro recibe carta de mho  donde reseña situacion en medios de venezuel las formas mas ingeniosas de evadir impuestos desde la epoca de los roman sippuntacana luis almagro  tendra derecho de palabra hoy en reunion de la sip pitbull y enrique iglesias estrenaron nueva cancion caricuao vivio tres linchamientos de manera simultane fotos la solucion de hidrocapital al bote de agua en la avenida andres bello 
4,Globovisión,isturiz este lunes habra anuncios sobre nuevos precios en algunos product conozca la receta natural con la que mejorara sus relaciones sexuales para siempr isturiz este lunes habra anuncios sobre precios en de algunos product acusan a gerentes de conviasa por corrupcion  envideo keiko fujimori acudan a votar con ilusion eleccionesperu venezuela expreso condolencias a india por incendio en templo que dejo mas de muert keiko fujimori se impone sobre ppk y veronika mendoz enrique marquez el gobierno quebro venezuela  atentado terrorista en peru deja varios muert capacidad de plantas termoelectricas es de mil megavatios y solo generan mil   muertos tras accidente de autobus nercelys soto consiguio medallas de oro y bronce en grand prix de atletismo en chil edgar ramirez yo ya se pel acusan a gerentes de conviasa por corrupcion  acusan a exdirector de el rodeo i por facilitar armas y explosivos a internos  florido delcy rodriguez demuestra gran desconocimiento de sus funcion estas posiciones de miley cyrus te sorprend conoce cuales son los beneficios del pepino para tu salud neonatos fallecidos en zulia durante primer trimestre del añ observatorio venezolano de salud pidio a maduro aceptar ayuda humanitari hallan en la morgue a reo de el marit filipinos se despiden con tristeza de pacquia nacho cumplio el deseo de su hijo en el hospital j m de los ri conoce las opciones naturales para mejorar tus relaciones sexual jefe de la policia de merida fue regresado a sede del sebin   mas trabajo es lo que hace falta para producir electricidad por   nacho lanza nuevo tema inspirado en seguidores de instagram anuncian paro de transporte en varios estados del p paolillo confia en acciones de almagro para defender la democracia sip fallecio el periodista guillermo varg embajador peruanos asistieron masivamente a centros de votacion en venezuel serviciopubl serviciopubl nave de la nasa experimenta problemas a miles de kilometros de la tierra  gabinete economico evaluara sistema de exportaciones en zuli japon aumenta inversiones en energia renovable  detienen a mujer por maltrato infantil en zuli conoce estas alternativas naturales para mejorar las relaciones sexual silicon valley apuesta que el futuro esta en la ia  filipinos se despiden con tristeza de manny pacquia estos son los beneficios del pepino que no conoc maduro celebra integracion al congreso de la patri paolillo confia en acciones de almagro para defender la democracia sip sorprendete con estas posiciones de miley cyrus haciendo yog florido delcy rodriguez demuestra gran desconocimiento de sus funcion rahal propuso interpelar al comandante de la gnb y la armada de nueva espart acusan a exdirector de el rodeo i por facilitar armas y explosivos a internos  acusan a gerentes de conviasa por corrupcion  edgar ramirez yo ya se pel anuncian paro de transporte en varios est
5,ElUniversal Política,marquez en la guerra de poderes perdemos todos an  marquez en la guerra de poderes perdemos todos an  marquez el gobierno no gana otra eleccion en venezuela an  capriles recurre a video de chavez para exigir un referendo contra maduro  torrealba sin movilizacion de calle no existe salida pacifica  escarra la an esta en libertad de solicitar la enmienda  alemania nego informacion sobre turbios negocios en venezuela panamapapers   video cne comunicaciones para activar revocatorio no han cumplido con requisit almagro dice que apelara a la conciencia de maduro por los presos polit capriles revocatorio tiene como fecha tope el enero d gonzalez lopez acciones paramilitares buscan generar terror en el p ee uu exhorta a venezuela a liberar presos polit cancilleria acusa a rajoy de apoyar a la oposicion detenido director del hospital luis razetti de barcelon ministerio de la cultura pintara ojos de chavez en el centro simon boliv borges pronunciamiento de herman escarra no tiene ninguna import cne comunicaciones para activar revocatorio no han cumplido con requisit tibisay lucena comunicaciones para activar revocatorio no han cumplido con requisitos cne  ramos allup no tengo duda que ganemos la asamblea en otras eleccion video hermann escarra reta a henry ramos allup a un debate de cara al p maduro pide al tsj declarar inconstitucional la ley de amnist an aprobo la ley de titulos de propiedad de la mision vivienda  escarra pide a maduro enmienda para reducir a dias el periodo de la asamblea nacional vivas ley de amnistia viola a la constitucion gobierno  guanipa el proceso de referendum revocatorio esta activ oficialistas marchan en contra de la ley de amnistia gobierno  mejia crisis universitaria esta llegando de nuevo a una calle sin retorn capriles la mayoria de los venezolanos esta a favor del revocatorio mud   capriles la produccion es la unica manera de recuperar la economia oposicion  maduro decreta dias viernes como no laborales hasta mayo por ahorro energet decretados viernes de abril y mayo no laborables para ahorro energet an difiere discusion de ley de propiedad para la gmvv manifiestan contra la ley de propiedad en las afueras de la an fvm presento a la an anteproyecto sobre discusion de contratos colect proxima semana defensoria del pueblo y min salud sostendran mesa tecn chavez ley de propiedad es otro pago de la oposicion a sus financ diputada lozano buscan callar la voz del puebl soto rojas la oposicion no tiene la masa suficiente para revocar a maduro an  desalojan sede administrativa de la asamblea por supuesto expl desalojan sede de la asamblea por supuesto explosivo en las inmedi denuncian hallazgo de medicamentos vencidos en yaracuy salud apucv gobierno intervino las universidades por una ideologia politica educ dejan sin efecto cierre del caso del maletin investigacion centrada en antonini wilson paz del pais depende en gran medida del cne parlamento aprueba proyecto de ley para atender crisis humanitaria en salud video miguel pizarro de rockero a polit el orden del dia de la an es modificado a ultima hor ramos allup denuncia que seguidores del gobierno bloquean su paso a la an capriles lucena es corresponsable de lo que pueda suceder en este p almagro pide a maduro que firme inmediatamente la ley de amnist
6,Noticiero Digital,venezolano emprende carrera musical en redes rociales vide hinterlaces de los venezolanos considera que la crisis es grave o muy grav venezolano emprende carrera musical en redes sociales vide capriles llama mentirosa a lucena y publica video de chavez defendiendo el revocatori maduro en venezuela la gente esta rozagante y bonit comunidad descubrio a hombres robando y los entrego a la policia desnud dayana mendoza pidio alimentos para niños del jm de los ri ramos allup retira mas retratos de chavez y objetos de bruj prohiben en eeuu cuadro de donald trump desnudo y con genitales diminut vehiculos robados y dinero enterrado se encontro en el marit chuo torrealba agenda golpista esta cobrando terreno dentro del oficial fiscal pide investigar a cristina fernandez y a julio de vido por presunto lavado de diner tomas guanipa el revocatorio no es una decision de la presidenta del cne sino del puebl secretario de la oea pide tomar conciencia por presos politicos en venezuel julio borges emplazamos a nicolas maduro a que firme las leyes aprobadas por la an tomas guanipa este año toca revocar a maduro y no habra nada ni nadie que pueda con el puebl asdrubal chavez la expresion crisis energetica para venezuela no apl almagro considera grave mencion de politicos de america latina en papeles de panam acusan al exdirector de el rodeo i de facilitar ingreso de armas y explosivos al penal familiares de jefe de la policia municipal de merida denuncian que fue detenido nuevamente por el sebin wiston cabas de los mil megavatios de termoelectricas solo mil estan dispon ángel oropeza y pico de cada venezolanos exonera al gobierno de cualquier respons hinterlaces de los venezolanos considera que la crisis economica es muy grav jesus faria muchos extranjeros estan interesados en invertir en venezuel manuel malaver el dia que el general padrino lopez se solto el moñ adan chavez sobre abril de era un secreto a voces pero el golpe nos agarro un poco confi enrique marquez venezuela quebro y la quebro el gobierno actual quiero que mis hijos estudien pero si no hay comida como van a ir con hambre al lice control ciudadano solicita mocion de censura contra padrino lopez antonio sanchez garcia empantan eli bravo las cuentas del alm jose guerra mi lectura de la infl control ciudadano solicita mocion de censura contra min padrino lopez edgar ramirez los venezolanos debemos comenzar a perdon manuel corao nicolas maduro frente a un posible revocatori isaias marquez arco minero e imatac maria auxiliadora dubuc violencia a pedir de boca ajusticiamientos o linch jose cheo salazar personajes de mi pueblo lazaro vivino guerr lilian tintori recibe en noruega premio por la democracia y los ddhh en nombre de leopoldo lopez el nacional dolar flotante aumento mas de en tan solo d min gonzalez lopez denuncia escalada de violencia con tintes paramilitar jesus petit da costa los “cubazuelanos” estan enviciados en la traicion la verdad hay hambre “como arroz” en la vill portadas del dia abril caricaturas del dia abril escarra la enmienda se puede utilizar para acortar mandatos del presidente y de la an prohiben en eeuu cuadro de donald trump desnudo y con genitales diminut escarra en la hojilla la ley de amnistia es una ley de guerra hecha por fasc escarra en la hojilla la ley de amnistia es una ley de guerra hecha por fasc maduro busca debate con rajoy donde quieras cuando quieras y como qu
7,Informe21.com,sorprende con esta rica receta de pollo a la naranj isturiz es necesaria la transformacion radical del sistema de distribucion de aliment cuantas veces hay que ducharse a la seman rousseff tendra prueba de fuego para mantenerse en el pod ucrania yatseniuk cede a las presiones y dimite del cargo de primer ministr nercelys soto consiguio medallas de oro y bronce en grand prix de atletismo en chil santos llama a acabar con la sed de venganza para alcanzar la verdadera paz increible se maquilla junto al cadaver de su novi the strongest sufre la baja de chumacero para el partido ante trujillan deliciosa pasta carbonara con jamon prosciutt borges emplazamos a maduro a que firme las leyes aprobadas por la an richard blanco afianzaremos nuestra decision de rescatar a nuestra venezuel capriles a lucena si es necesario exigirle que cumpla con su trabajo a diario lo h el deportivo tachira cede puntos tras igualar con el portuguesa en cas marquez afirma que gobierno busca bloquear el cambio polit bailar protege el cerebr hay que educar a los motorizados para que acaten ley pasteles salados la nueva apuesta que despertara tus sent sip crimen organizado y corrupcion principales enemigos de los period almagro pide tomar conciencia por los presos politicos en venezuel gobierno mantiene meta de captar millones en export acusan a exdirector de el rodeo i por facilitar armas y explosivos a los int adan chavez golpe de estado de fue dirigido por los medios de comunicacion priv fallecio el periodista de union radio guillermo varg se te olvido tomar la pildora asi reacciona tu cuerp brasil iniciara primeros test en humanos de suero contra picaduras de abej bid latinoamerica frenara al su ritmo de crecimiento anual hast hinterlaces mayoria de venezolanos opina que la situacion economica es grav un partido de cricket para iniciar la visita de guillermo y catalina a indi dejate llevar por la energia de los color sin gluten bizcochitos de chocolate y zanahori mexicano zurdo ramirez es el nuevo campeon supermedian medina inaugura la reunion de la sip y reafirma su apoyo a la libertad de prens luis florido se avergüenza del trato a rajoy y la oea correa pide no dejarse manipular por la informacion de los papeles de panam el napoles golea sin higuain al verona e impide la escapada del juventus la calima invade el aire de venezuel la capsula dragon de spacex llega a la estacion espacial internacional presentan el proximo icono de dubai una torre mayor que burg jalif pacquiao gana su pelea de despedida ante bradley viajeros no pagaran tasa aeroportuaria en dolar vardy da otra victoria al leicester que se arrima al titul chad y comoras votan en las presidencial el g se reune en hiroshima con la visita inedita de kerry venezolano luis orta clasifico a ri plantan el primer bosque flotante en las aguas del puerto de rotterdam los aspirantes a suceder a ban ki moon a exam mas de muertos en el incendio de un templo en indi
