,userNames,userTweets
8,Juan Carlos Aguirre,ojo este lunes oposicion venezolana estara llevando la ley de amnistia a ginebra v despiertame cuando pase el temblor venezuela gt gt y de abril caramelosdecianuro en concierto entr y todos creyendo en la lista falsa del panamapapers por eso es que estamos como est cada quien hace lo que quiere con sus cuentas se reserva el derecho de admision a esta hora se reunen y con la comunidad venezolana en mexico siempre hay tiemp desde cdmx no queremos que america latina se pronuncie despues de un golpe de est tubazo pdte del prd preocupado por presos polit tubazo presidente prd preocupado por presos politicos en venezuel urgente presidente del prd mexico preocupado por violacion de derechos humanos en venezuel mirar en periscope en punto crit en directo en periscope en punto crit condena pan intencion de disolver asamblea nacional de venezuel ojo leyendo entrevista a diputado venezolano pascal beltran  ojo el prd si recibio apoyo chavista pinradi no queremos q america latina se pronuncie despues de un golpe de estado pinradi les trae en conicerto a en puntofijo este de abril entr no somos malandros pinradio y desde cdmx v la lucha por la democracia nunca ha sido pacifica ni se consigue con flores esta llena de sacrificios en cdmx diputados venezolanos reciben condecoracion en ciudad de mexico v ojo militares no tenemos o por lo menos eso no lo sabemos pinradi les trae en concierto a en barquisimeto este de abril entr sala constitucional del tsj contara con magistr senado mexicano vemos con preocupacion que el orden contitucional no esta en plenitud de funcion al aire en ya con desde mex en directo en periscope en vivo por excelsiortv desde mexico con en minutos senado mexicano junto a y se pronunciara ante anuncio d pdte senado mexicano vemos con preocupacion que el orden contitucional no esta en plenitud pinradi la corrupcion no prescribe no pueden ser objeto de amnistia v amenaza rt querias minutos de fama felicitaciones te saldra caro y hasta un favor nos hic urgente esto dijeron y ante el senado mexicano v maduro se equivoca si cree que nuestro talante democratico ha sido cobardia v urgente desde cdmx esto es un golpe de estado en pleno siglo xxi y no podemos permitir v diputados y en senado mexicano denuncian desviacion del orden constitucional en vzl puntofijo este de abril en concierto entradas otro event a diputados venezolanos “en venezuela hay una fractura del orden constitucional gt gt exclusivo calderon a dip venezolanos no solo es un gobierno autocratico hay una fractura constiticional vi diputados y reunidos en cdmx con barquisimeto este de abril en concierto entradas otro event urgente pelea con botellas y piedras en pajaritos gnb brinda proteccion a chavistas v fanatismo dios tenga misericordia a todos aquellos que critican al pastor bertucci ojo chavistas critican a maduristas v por falta de quorum fue suspendida la sesion de an v quien dice que es fals al aire ya por navegando por las redes tarde pero seguro v ojo este viernes daria rueda de prensa explicando su aparicion en panamapapers … v ojo defensores d a periodista “con lo que hablaste no crees en dios” … via panamapapers ojo defensores de critican a periodistas “con lo que hablaste no crees en dios” ojal
9,Reporte 360,venezolanos con nacionalidad estadounidense no requieren visa el diario la voz fue o no fue penalty mexico holand extraoficialmente cuerpos sin vida ingresaron a la morgue de bello monte este fin de semana noticierovv asesinan a presunto delincuente al intentar atracar a cicpc en barrio de maracaibo diario la verd matan a hombre dentro de su casa ” extraoficial secuestran a la jefa de redaccion de globovision diariodecarac separados al nacer stalin y maduro fotocomparacion la patill matan a puñaladas a hombre en un hotel de caracas superconfirm motorizados asesinaron a joven en ocumare del tuy superconfirm secuestraron y asesinaron a dos ciclistas en el ávila superconfirm reportan secuestro de jefa de redaccion de globovision nairobi pinto sunoticier denuncian ataques contra sede de gobernacion del tachira la patill pdte maduro si la fiscalia ordena detener preso a ramon muchacho ira preso vtvnotici tachira vielma mora protestas en el estado han sido muy violentas ” sunoticier oposicion se concentra en avenida las palmas fotos super confirm fallecida en persecucion de la francisco fajardo era funcionaria del sebin sunoticier nicolas maduro a eeuu respeten a venezuela y establezcamos nuevos modelos de comunicacion primici dos mil asesinatos de han registrado en venezuela entre enero y febrero sunoticier diosdado cabello nos resbala cualquier decision que tome la oea audio yvke mundial presidente nicolas maduro concedio una entrevista a christiane amanpour de cnn sunoticier carolina herrera se pronuncia sobre venezuela el impuls oliver stone dice que extraña a hugo chavez unotici melendez hoy vamos a mostrarle a venezuela y al mundo una gran union civico militar el nacional capriles llamo a conformar comando de defensa del pueblo analit manifestantes llenaron playa lido con cruces y lapidas ayer m lecheria foto el nacional los ecos de los óscar siguen en venezuela tras una ceremonia que no se vio diario de carac rodriguez torres denuncio el secuestro de un gnb en tachira sunoticier botan a periodista de vtv por criticar al seguro social la patill jared leto le dedica unas palabras a venezuela tras recibir su oscar como mejor actor de reparto diario la verd inicia cadena nacional de radio y television globovision maduro el pueblo soberano no se deja someter por nadie yvke mundial leopoldo lopez asume su llamado a la calle y dice que lo volveria hacer desde la càrcel militar el nacional plaza diego ibarra sera el escenario de los dj s de caracas este domingo vtvcanal eeuu sube el tono y amenaza a rusia con su expulsion del g el pais las playas estan abarrotadas para disfrutar carnaval segun el troudi video la patill en imágenes las marchas de la oposicion este domingo en varias ciudades de venezuela diario panoram ledezma el que esta provocando la violencia es el propio gobierno el mund matan a cinco sicarios en miranda sucesoslv diario la verd ministro de educacion las clases reiniciaran el de marzo venezuela diario panoram terminal de oriente con menos afluencia que en carnavales anteriores la patill ordenan a inteligencia militar capturar a carlos vecchio venezuela el universal vecinos trancan nuevamente el cafetal el nacional video estudiante agredido con fusil desmiente a fiscal general el universal maduro asoma que zum tv podria sustituir a cnn en las cableras unotici winston vallenilla denuncia ataques contra su vivienda en prados del este globovision vielma mora  capriles radonsky vive mas en el tachira que en miranda diario panoram mas artistas se solidarizan con venezuela nacional mcm no puede hablar de dialogo quien tortura a estudiantes el nacional shakira espero que los venezolanos puedan sentirse a salvo en su pais el impuls
10,El Impulso,“en la carcel debe imponerse la ley” el impuls hay una agenda golpista dentro del oficialismo el impuls causa r acepta la contraenmienda de hermann escarra el impuls escasez de alimentos agudiza crisis en casas hogares el impuls revistagala noche de chicas clasicas peliculas entre amig fundacion dejando huellas celebra cuarto aniversario el impuls revistagala arpista larense entre cuerdas y sonidos venezolan publicidad actualiza conocimientos sobre retenciones de iva islr e igtf con nuevo taller que tra embalse dos cerritos esta abandonado el impuls segun almagro oposicion solicitaria aplicacion de la carta democratica a final de m sonda exploradora kepler esta averiada en el espaci revistagala hip hop el arte de lo urban familiares sufren por hospitalizados el impuls la increible historia de amor entre un rinoceronte huerfano y su cuid revistagala norberto de abreu y su trabuco de expresion se pretende ignorar toponimia historica en palavecino el impuls revistagala alejandro gonzalez iñarritu genio y figura de la gran pantall macario gonzalez vamos a recuperar tiempo para impulsar el revocatorio el impuls the boss derrota en taquillas a batman y superm hoy iniciaria en lara plan de racionamiento nacional el impuls revistagala nacho redondo “ser comediante es mi terapia” impresos han salido de circulacion de manera temporal o definitiva el impuls mas de muertos por fuerte incendio en un templo en indi anuncian paro de transporte en varios estados lara entre ell es necesaria una ley de amnistia que devuelva a presos politicos a sus famili estrenan el trailer de la pelicula hands of stone protagonizada por edgar ramirez escasez de alimentos agudiza crisis en casas hogar arquidiocesana vamos a pesc el trafico aereo cambio el destino del vigilante del aeroclub de barquisimet cicpc detiene dos hombres por robo a comerci joven estudiante pierde la vida en accident joven asesinado en la venezuela tenia dos trabajos para mantener a su famili zakarias zafra la literatura como nort piedras y formas colman el taller artesanal bachaco roj fundacion dejando huellas celebra cuarto aniversari policia fc falla ante socop tachira y zamora comparten la cim deportivo lara visita a llaner sanare fc mantiene invicto en liga internacional rondon se lesiona y seijas a brasil mp acuso a exdirector de el rodeo i por facilitar armas y explosivos a los int kata local luce en cita juvenil ildemaro ruiz al panamericano de puebl liga menor campeon en juvenil aa felix hernandez por su primera victori eugenio suarez vuelve a producir para cincinnati marinos despide al coach ricardo maffei greivis vasquez anota cinco punt lisandro alvarado un tocuyano ejempl xiomary descubrio a catalina y a barquisimet
11,ElUniversal_Ccs,asesinan a funcionario adminsitrativo del cicpc en ruiz pined se fugan internos de carcel de cabim alias cara e pizza lidero fuga y triple homicidio en cicpc el vall reinauguran tercera etapa de paseo anauc inameh preve lluvias dispersas y lloviznas aisl invitan a formular proyectos de renovacion urbana para chaca protesta de trabajadores de corpoelec tranca av francisco de mirand impulsan desarrollo turistico en vargas con empresas social puntos vulnerables presentan vias de entrada y salida a carac detenidos del cicpc el valle salen de calabozo y matan a tres funcionarios  aprueban ordenanzas para personas con autismo caracas   estacionamientos de chacao anuncian nuevas medidas de presion para lograr aumento de tarif este miercoles municipios de barlovento estaran sin agu hoy haran mantenimiento en distribuidores viales de carac este miercoles preven lluvias para caracas y gran parte del p comunidades de caracas se organizan para conseguir medicinas  establecen dos tarifas diferenciales para el impuesto de salida del pais vargas   en espera continuacion de obras del metro en caracas y guaren cierran calle en sector gavilan de elhatillo por falta de agu restringen paso por la carretera panamericana por trabajos de corpoelec  preven lloviznas en caracas en horas de la tard controlan incendio de autobuses yutong en guatir controlan incendio de autobuses yutong en guatir ejecutan plan de mantenimiento en cinco vias de caracas caracas  inicia hoy operativo vial por llegada de nuevo tren metropolis caracas miranda  sundde sancionara a practimercado dia a dia en carac se reunen con estudiantes de residencias en libertador para mejorar calidad de vida caracas  continuan labores de extincion de fuego en parque nacional macarao carac alcaldias de baruta sucre y chacao cumplieron meta de recaudacion de rentas municipal asesinado a tiros custodio de la carcel de la pica sucesos monag usuarios del transporte publico en caracas rechazan aumento del pasaje caracas pasaje  el universal cumple años con informacion ininterrump cadaver de sacerdote fue hallado en un parque de san cristobal sucesos   delincuentes asesinan a paciente en una ambulancia suces nuevos proyectos aprobados para miranda por el consejo estadal de planificacion mirand recogen firmas para activar entrega de medicinas desde el exterior caracas saludpublica  alcalde david smolansky presento su memoria y cuenta de gestion carac ultiman a un oficial de la pnb en mariche para robarlo  suces reactivan red empresarial para enfrentar emergencias chacao caracas caracas electr caraqueños buscan dar una segunda vida a los objetos carac mueren en enfrentamiento dos delincuentes en l en miranda impulsan desarrollo economico con cursos socioproduct chacao insta al sector privado a cancelar impuest vecinos e industriales aplican acciones contra la insegur preven tarde calurosa para el valle de carac en caracas se atendieron incendios de vegetacion hasta marzo d entregan aportes bs mil para reacondicionar escuela de petar entregan aportes bs mil para reacondicionar escuela de petar unificaran en consultorios populares atencion primari en disminuyo afluencia de turistas en miranda durante semana sant
12,ElUniversal_Suc,gonzalez lopez acciones paramilitares buscan generar terror en el p promotora de programa de alimentacion es privada de libertad por corrupcion diputada lozano buscan callar la voz del puebl muere guardia nacional en enfrentamiento en la troncal   sucesos  bernal pide tolerancia cero contra criminales   detenidos del cicpc el valle salen de calabozo y matan a tres funcionarios  descartan explosivos en sede administrativa de la an hampones atacan sede del cicpc elvalle y matan a tres funcionari acusada mujer por muerte de su hija recien nacida en mer en lara refuerzan seguridad en zonas comercial abatido homicida del general gonzalez arreaz autoridades se deplegaron en caña de azucar maracay por ataque con granadas al cicpc atacan con granadas subdelegacion del cicpc en maracay secuestradores asesinan en el estado miranda a exjefe del cor presumen que avioneta siniestrada este vinculada con el narcotrafico zulia  asesinado a tiros custodio de la carcel de la pica sucesos monag pnb desmantela banda de falsificadores de documentos caracas pnb   cuerpo del sacerdote asesinado en san cristobal fue reconocido por empleado de la morg venezolanos detenidos por drogas en dominicana son solicitados por interpol venezolanos detenidos por drogas en dominicana son solicitados por interpol asesinan al alcalde del municipio la ceiba en el estado trujill cadaver de sacerdote fue hallado en un parque de san cristobal sucesos   delincuentes asesinan a paciente en una ambulancia suces explosion en base naval de puerto cabello deja un muerto y seis heridos suces ultiman a un oficial de la pnb en mariche para robarlo  suces encuentran el cadaver carbonizado de un hombre en altagraci mueren en enfrentamiento dos delincuentes en l asuntos penitenciarios intervendra en carcel de el marit marzo contabiliza ingresos de cadaveres a la morgue de carac operacion de pago controlado por moto robada deja un muerto y her hampones desvalijaron siete colegios en puerto cabell fallecen dos policias arrollados por encapuchados en protesta del tachir matan a comerciante de origen libanes en el cementeri fallecidos durante la semana santa en el zuli privan de libertad a tres gnb por decomiso de droga en dominican reclusos del reten de el marite roban carros y los guardan en el penal asueto cerro con ingresos de cadaveres a bello mont siete fallecidos por accidentes de transito y tres ahogados en falcon fallecidos de transito y ahogados dejo la semana santa en falcon asesinan a activista politico en los valles del tuy delincuentes ejecutan atraco masivo en clinica de valent jueza dominicana libero sin cargos a venezolanos acusados de narcotraf jueza dominicana libero sin cargos a venezolanos acusados de narcotraf detienen a cinco hampones por robo masivo en vagon del metro de carac decomisan panelas de drogas en guar cadaveres han sido ingresados este mes a la morgue de carac rescatan a funcionario de polibaruta que fue amenazado de muerte en coch falso paciente asalto en el hospital de paraguan decomisan panelas de drogas en guar hieren a escolta del director de polimiranda en macara
13,Noticias Venezuela,robinson chirinos se perdera dos meses de temporada con los rangers este lunes sera instalado congreso de la patria capitulo cultura e intelectual cierran colegios electorales de los comicios generales de peru <U+2705><U+2705>luis vicente león el pais vaci keiko fujimori se impone con de los votos sobre kuczynski y mendoz cierran colegios electorales de los comicios generales de peru <U+2705><U+2705>luis vicente león el pais vaci keiko fujimori se impone con de los votos sobre kuczynski y mendoz inciarte pasa a la lista de lesionados de d cierran colegios electorales de los comicios generales de peru <U+2705><U+2705>luis vicente león el pais vaci keiko fujimori se impone con de los votos sobre kuczynski y mendoz <U+2705><U+2705>carlos dorado los papeles de panam keiko fujimori habria ganado la primera vuelta de las presidenciales de peru caraqueños recogen agua de la calle en la avenida andres bello fotos liqudan al “pelon” en zuli rafael correa pidio que se difunda todo la informacion de panama papers flash electoral ipsos keiko ppk y mendoz venezolano emprende carrera musical en redes sociales vide secretario de la oea pide tomar conciencia por presos politicos en venezuel como y cuando se inventaron los paraisos fiscal pitbull y enrique iglesias estrenaron nueva cancion mujer ebria le cayo a golpes a su hijo de añ cierran colegios electorales de los comicios generales de peru el venezolano que lavo millones de dolares del narcotrafico colombian argentina mas de   mil evacuados por fuertes inund hinterlaces de los encuestados no confia en la oposicion para temas econom sargento de la gnb muere al chocar su moto contra un camion frente al cor odubel jonronea y jeanmar gomez salva el triunfo de filis nercelys soto obtuvo medallas de oro y bronce en grand prix de chil miley cyrus sorprende a sus fans con sus habilidades en el yog ovs pide al gobierno aceptar ayuda internacional por crisis de salud al menos en estados anunciaron paro de transporte para el miercol detienen a banda que vendia armas por fb e instagram peruanos votan en venezuel roberto enriquez recibira informacion detallada de los panama papers gerentes de conviasa son acusados por corrupcion maduro trata de distraer los problemas de venezuela retando a rajoy a debat espn y porfi baloa se juntan para decir a ritmo de “clase social” viva el beisbol el diputado carlos paparoni sufrio un accidente en la via mucutuy merida fot impresionante fenomenos naturales que probablemente desconoces fot isturiz se reunio con productores agricolas del zulia para evaluar avanc ovs pide a maduro aceptar la ayuda internacional ante la crisis de salud y aliment atención el video de chavez sobre el referendo que maduro no quiere que v eudomario carruyo el ex vicepresidente de pdvsa que ‘panama papers’ dejo en la call comision de la gn arresto a tres miembros del “combo de la alianza” que opera en carabob retenidos mas de mil kilos de cemento en apur hermanos castillo bozo los banqueros de la revolucion que aparecen en los ‘panama papers’ “no hemos dado lo suficiente” nacho visita el j m de los rios para regalar insum g b julio barrio comandante de la brigada carib
14,Prodavinci,santiago y el silencio… a pesar de coldplay por el radical conservador por jorge volpi cuando firmar articulos en tu periodico casero es un acto de valentia la union por losmasleidos las primeras firmas del evento civico yorevoco por el lente de manuel reveron eleccionesperu el cambio se escribe con k por carmen beatriz fernandez losmasleidos la via electoral hacia la dictadura por losmasleidos fotogaleria el evento civico yorevoco en retratos de roberto mat losmasleidos el pais que espera la lluvia por michael penfold losmasleidos yorevoco por yorevoco por fotogaleria el evento civico yorevoco en retratos de roberto mat el evento civico yorevoco documentado por el lente de giovanna mascetti vea aca el trailer del primer spin off de starwars ‘rogue one a star wars story’ el pais vacio por luis vicente leon al limite el estado comienza a perder sentido por luis garcia mor peru el cambio se escribe con k por carmen beatriz fernandez eleccionesperu ’ “el periodismo no puede ser el megafono del poder” por hugo priet peru el cambio se escribe con k por carmen beatriz fernandez eleccionesperu al limite el estado comienza a perder sentido por luis garcia mor yo creo que la intencion de comprar esos medios era convertirlos en cascarones vacios liquidarlos complet lo que el gobierno tampoco ha dicho es que la inflacion en supera con creces la del año anterior peru el cambio se escribe con k por carmen beatriz fernandez hacia un nuevo gobierno en peru por rafael roj el pais vacio por la via electoral hacia la dictadura por la lucha por el poder y la ley de amnistia por andres stambouli revocar el miedo palabras de alberto arteaga en el evento civico yorevoc losmasleidos las primeras firmas del evento civico yorevoco por el lente de manuel reveron peru el cambio se escribe con k por carmen beatriz fernandez eleccionesperu al limite el estado comienza a perder sentido por luis garcia mor losmasleidos la via electoral hacia la dictadura por fernando mir allimite el estado comienza a perder sentido por luis garcia mor el de los lentes es gonzalo barrios por unafotountext losmasleidos fotogaleria el evento civico yorevoco en retratos de roberto mat ’ “el periodismo no puede ser el megafono del poder” por hugo priet losmasleidos el pais que espera la lluvia por michael penfold losmasleidos yorevoco por el pais que espera la lluvia por michael penfold alfredo meza “el periodismo no puede ser el megafono del poder” por hugo priet se rompen los diques del comportamiento y del orden social de la legalidad en todos los nivel el pais vacio por patrick modiano en el cafe de la juventud perdida por alejandro oliver
15,Alfredo Meza,es venezolana de television canal venezuel uno es un inmoral el otro es un delincuent victor hugo majano y orlando romero harrington nuevo post panamapapers ronna risquez traza un esplendido perfil de martin lustgart no te lo pierd esta noche a las vtv transmitira un debate sobre los papeles de panama modera william castillo este servidor forma parte del panel he tenido la fortuna de ser entrevistado por el maestro hugo prieto esto dije sobre panamapapers nuevo post de los papeles de panama escribe sobre el financiero martin lustgarten panamapapers fabiola zerpa revela por que los hermanos banqueros castillo bozo aparecen en panamapapers un abrazo graci nuevo capitulo de la saga de los papeles de panama en venezuela presentamos a los hermanos castillo boz esta es la historia de como se involucraron once venezolanos en panamapapers increible pero cierto el unico canal venezolano en señal abierta que ha entrevistado a reporteros de panamapapers venezuela  agradezco a la invitacion a su programa tv foro en vtv canal la cita es el domingo a las p m la vida secreta de panama city enorme nota de jon lee anderson panamapapers panamapapers nuevo capitulo de la saga panamapapers de venezuela el embanque gonzalo tirado y el plan para proteger su herent maduro amenaza con disolver al parlamento venezolano mi nota mas recient no parece honesto q el pastor bertucci se victimice tras negarse a responder preguntas antes de la publicacion de su historia panamapapers es la luchadora mas famosa es sexy y gana euros por segundo trabaj el pastor javier bertucci se nego a hablar con antes de que su nombre apareciera en el capitulo venezolano de panamapapers e carruyo exvicepte de finanzas de pdvsa lecciones para enriquecerse a costa del erario publico panamapapers cronica del linchamiento de un inocent nuevo post panamapapers de venezuela clase magistral de eudomario carruyo para ocultar la riqueza siendo ostent la farsa de las empresas mixtas chavistas queda desvelada en esta gran investigacion de panamapapers un nuevo capitulo en la serie panamapapers venezuela la felicidad de la familia yammine escrib quieren saber quienes son los grandes beneficiarios del negocio de los carros chery sepanlo en panamapapers ese menos es un mensaje a los que tienen rabo de paj nada que ver esteban digamos que es un mensaje a garc algunas airadas criticas a panamapapers de venezuela pierden validez cuando provienen de quien cuida la imagen de un estratega financier el buen guillermo vargas aufrio un acv y necesita epamin de mg para salvar su vida contacto ivette janz
