,userNames,userTweets
33,Diario El Informador,se agudiza el conflicto ente scioli y mariotto en la provincia de buenos air hemos podido recobrar nuestra cuenta de twitter que nos habia birlado el diario el informador de venezuela gracias a la seguridad de twitt chavez el majunchismo tambien se estrellara a nivel internacional como se ha estrellado con la realidad venezolan chavez ahora en esta fase debo seguir las directrices medicas con el favor de dios que ire instalandome en la primera linea de la batall chavez debo informar que en estos ultimos dias hemos culminado de manera exitosa las radioterapias tal cual te planific chavez el crecimiento de la economia en el primer trimestre sera muy bueno segun informacion que me dio merentes presidente del bcv chavez en cadena nacional a todos ministros mi reconocimiento por su trabaj en cadena nacional de radio y tv el presidente chavez desde el aeropuerto de maiquetìa tras su regreso desde cub asaltan a la actriz elaiza gil en avenida libertador de carac anuncian la emision privada del bono pdvs franco de vita prepara himno para la vinotint publican en internet claves de twitt presidente chavez llega al pais esta noch el cantante mexicano luis miguel satura en madrid los niveles de pasion cne enviara desde el de mayo invitaciones a acompañantes internacional anuncia ya en el avion sobre la pista del jose marti rumbo a la patria venezolana con mas optimismo que nunc obama insta a congreso a que ayude familias afectadas por crisis inmobiliari presidente de cantv anuncio nuevos beneficios para trabaj hillary clinton encabeza la lista forbes de madres mas poder mujer virgen de años asegura estar lista para el sex hermano de walid makled fue trasladado de emergencia al hospital milit caveme asegura que existe normal abastecimiento de medicamentos en el p sismo de magnitud en israel y los territorios palestin  estoy pidiendole auxilio a la presidenta del circuito judicial penal  dice la directora de polil fondo nacional de deporte ha recaudado mas de bs millon acusaron a cuatro policias de miranda por concusion en caso libero iaizz eeuu confirma que sostiene conversaciones con aponte apont cnp barinas condena agresion contra camarografo de vtv farmaco que previene el contagio de vih a punto de ser una real getafe y cd lara se enfrentaran en cabudare el de may exjefe paramilitar colombiano asegura que auc financiaron a uribe  inundacion en cabudare en los sectores las amapolas y la puerta en palavecino lara v chavez debe sincerar su estado de salud dice la diputada rosaura sanz un muerto y dos detenidos en tiroteo en la estacion del metro chaca el informador te lleva al metropolitano para que presencies el encuentro entre cdl y el getafe atent canasta alimentaria subio a bsf en abril segun el ine el sexo oral causa mas cancer en los hombres que fum secuestran a dos hermanos adolescentes en guanar reportan tiroteo en la estacion de chacao en el metro de caracas v el palo de agua que esta cayendo en cabudare no es normal esta foto es por el recre ministro navarro sospecha que hacen sabotaje al sistema electrico nacional acusan a seis hombres por homicidio del exgobernador de apur capriles declaro enemigos de la patria a la guerrill venezolanos buscaron apoyo contra chavez en colombia segun mancus debaten en copei sobre la tarjeta un ministra sader inaugura cuatro salas de hospitalizacion en el jose maria varg iran condena atentados de damasco que atribuye a opositores al regimen siri lavrov advierte que injerencia extranjera y sanciones unilaterales promueven el ca continua tiempo lluvioso en todo el p
34,VVSincensura,celebran partidarios de eleccionesperu flash electoral de los medios peruanos eleccionesperu expresidentes alan garcia y alejandro toledo no superaron el de la preferencia electoral en peru eleccionesperu pobre peru segunda vuelta podria ser fujimorismo vs chav flash electoral en peru habria segunda vuelta electoral en el segundo lugar hay empate tecnico entre ppk y la chavista veronika mendoz urgente flash electoral en peru encabeza el camino presidencial con el segun boca de urn flash electoral en peru el fujimorismo seria la primera minoria en el congres documental completo la caida de alberto fujimori farsante como todos los comunistas cualquiera cree estas en la extrema pobreza y estudiaste en fr pablo iglesias apoya candidata chavista a elecciones peruanas si fuera peruano votaria por pd peru elige nuevo presidente a la hija de alberto fujimori encabeza las encuest cuatro causas complican panorama de la principal lavado de dinero vide la ley del arrepentido en argentina el instrumento legal que hunde al kirchner ifin de una era de impunidad imputan a por lavado de diner gobierno radicaliza racionamiento electrico en el interior del pais hasta horas de apagon al d con caracter de urgencia para paciente con cancer mabthera en ampollas de mg mg cardioxane o dexfeniran de mg remueven ojos de chavez de la sede administrativa de la an fot firma contra ley de amnistia es requisito obligatorio para comprar bolsa de comida en jornadas de mercal la reaccion de tibisay lucena ante la contundente pregunta de un tuitero vide hordas oficialistas sembraron terror en los alrededores del cne vide maduro ordeno al tsj declarar inconstitucional la ley de amnistia y reconciliacion nacional al menos explicaciones merecemos de viaje por el mundo en campaña para las gobern noticia internacional no por lo relevante sino por lo insolit escarra el hombre de la marcha sin retorno fue el vocero del madurismo hoy no justificamos pero si se equivocan los jueces no esperen no se equivoquen quienes ejercen la justicia popular de quien es la culp leemos que lincharon un inocente en los ruines lo unico que tenemos que decir es que el gobierno es doblemente culp asi atacaron hordas oficialistas a la manifestacion opositora en los alrededores del cne vide la gnb aliada con hordas violentas maduristas para evitar que la oposicion llegue al cne asi actuan las bandas delict cortesia hordas oficialistas atacan concentracion opositora en el cne tras confesar que feriado de semana santa no sirvio de nada maduro decreta viernes libre para ahorrar energ se merece la orden libertador le jalaron las greñas a iris varela en el reten de marite vide pedro carreño se gozo la boda de su sobrino bebio whisky bailo y toco culo fot diversas personalidades respaldaron hoy solicitud de revocatorio contra el regimen de vide ya el sebin esta investigando a los maduristas que difundieron rumor de bomba en pajaritos para causar zozobra y detener trabajo de la an cual es la viajadera que tienen algunos diputados opositores en plena crisis economica se justifican estos viajes quien pag como se llama un pais donde delincuentes atacan en la madrugada una institucion policial y liberan a los pres fuga masiva y tres funcionadios asesinados tras ataque a la sede del cicpc el valle esta madrug justicia argentina reabre causa de antonini wilson perfil lazaro baez de cajero de un banco a millonari diputada argentina celebra detencion de empresario ligado al kirchnerismo cuando cae el poder cae la impun argentina detiene a lazaro baez empresario ligado a la fortuna kirchner presentaron candidatas al miss aragua fot represion en urbe maracaibo por protestas estudiantiles vide editorial a la dirigencia opositor con caracter de urgencia para paciente con cancer mabthera en ampollas de mg mg cardioxane o dexfeniran de mg este gobierno debe cambiar de inmediato porque hay millones de vidas de por medio alguien se ha dado cuenta de la graved usted sera juzgado en tribunales internacionales por este genocidio silencioso que su desgobierno impuls sabra usted que hay gente muriendo de cancer porque no consigue tratamiento para quimioterapi renuncia primer ministro islandes tras escandalo de panamapapers tibisay lucena debe decidir si huye del barco o se hunde con el en sus hombros la paz y estabilidad de la republ
35,Política Venezuela,no hay regimen corrupto e ineficiente por mas armado que este que pueda enfrentar a millones que han podido ver una forma mejor de viv en apenas un año podriamos incidir en mas de mil barrios del pais impactando la vida de millones de venezolanos los mas olvid a mamera en caracas sta rosa en maracaibo o flor amarillo en valencia pero para limpiar sus calles brindar salud educacion diversion tenemos que hacer ya miles de marchas en venezuela pero para tomar los barrios del pais transformar la rabia en accion social construct como contrarrestar hoy la entrevista a henrique en venevision una forma seria anunciar aumento de sueldo a la misma hor henrique estara mañana en boliv rt henrique capriles sera entrevistado esta noche a las pm por eduardo rodriguez en noticiero venevision roberto casanova tesis de abril y mas all rt recursos en linea para quienes volveremos a votar en new orleans es cierto un modelo que para ser sostenible requiere incrementos del precio del petroleo de anual el gasto social ha aumentado cuantitativamente pero la calidad de su ejecucion ha empeorado dramat henrique capriles yo no soy oposicion yo soy la solu el paladin de los pobres del mundo seguro estos estarian mejor si en vez de cobrarles la energia a us por barril la pagaran  por razones similares amaban a pablo escobar destruia a millones en el mundo y repartia migajas entre quienes le rendian pleites alabar a un gobierno porque ha aumentado el gasto social obviando que ha recibido cientos de millardos de en plusvalias del exterior lagritaconcapril mi pobre p en el gobierno de los pobres la banca crece anual en valor real eso no se ha visto ni en el capitalismo mas salvaj por tantos asesinatos si han corrido muchas lagrimas pero para ellos no hubo honores ni aviones sobrevol asesinados en estos años en el piso uno detras de otro seria una procesion que le daria veces la vuelta a carac el gobierno venezolano decidio no hacerlo desde hace años gracias a la gobernacion de miranda volvemos a saber que pas aunque por supuesto analfabetas funcionales son varios millon a pesar de toda la propaganda oficial en el pais tenemos casi de analfabetas millon de person en ultimo estudio global pisa los niños venezolanos fueron los peores de latinoamerica en razonamiento verbal y numer cuando lo bajen del museo otro dia no laborable y sin clases asi cada dia haiti se ve mas cerc el sr tambien informa que schemel seria el director de en su nueva etapa post a segun hoy en las primeras encuestas indican maduro henrique ns nc de lo que no hay escasez en venezuela es de ideas embalsam este es un tuit desestabilizador gt en un pais serio el que iria preso es reverol estoy de acuerdo con ramirez a chavez lo asesinaron los que le maltrataron de niño los que le inocularon odio y comunismo los adul el de abril el bcv revela grave situacion economica de er trimestre incluido falta de divisas elecciones son el a rt maduro ha dicho el nombre chavez veces en dias lo que implica veces por dia y veces por hor un homenaje a consalvi y decidieron no discutir la enmienda para llevar a chavez al panteon ojala lo de hoy en la asamblea no sea un espejismo sino un timido paso hacia una nueva venezuel lo s medit en enero siguio cayendo produccion petrolera de venezuela felicitaciones al ministro ramirez seguro le aumentan el bon muy bueno que en las escuelas ayuden a los niños a superar el duelo con mil muertos hay mucho huerfano por ah bolivar ese si que era un apellido tambien vargas betancourt gallegos apellidos de gente decent va a encarcelar a cilia o nepotismo no es corrupcion rt guerra a muerte a la corrupcion promete maduro en pleno del pcv la muerte del caudillo excelente vargas ll no es gran cosa pero como siempre cuentas con todo mi apoyo tu eres lid el twitter de chavez lo heredara o algo similar solo tienen que cambiar el nombre no es obvi eso es correct los cadaveres embalsamados de ho chi ming lenin y mao han visto como sus paises se convierten en capitalismos salvaj es demasiado poco tiempo para lograrlo lo mas probable es que maduro flote sobre la ola emotiva y luego el fin para ganar henrique necesita activar a oposicion inhibir chavismo light y conseguir algun voto cruzado muy dur si la situacion es henrique con suerte llega a si logra activarlos a todos y ese es casi el piso de madur diferencias similares a las de chavez henrique ahora con maduro pero con pensando que chavez volvia veremos ahor ninguna anterior a la muerte de chavez es relevante a lo mejor las nuevas dicen algo parecido pero el cambio es muy relev
36,elnuevopais,just used background check it out fotos en primera plana el poderoso del regimen rafael ramirez comunismo hasta luis miquilena ya se dio cuent tenemos una mesa muda rafael poleo politica de hartur comida podrida fue distribuida al publico por pudreval pororden del actual jefe de pdval denuncian legisl primera plana venezuela pdvs columna de patricia poleo la razon oculta del control cambiari pudreval no acepta competencia gobierno contra vendedores informal eeuu dispuesta a dialogo franco con venezuel cilia flores encaleta memorias y cuentas de ministros denuncia juan jose molin en la mesa no hay estrategas politicos columna de hextor perez marcan asesinan hermano del fiscal danilo anderson primera plana miercoles venezuela pudreval primera plana martes venezuela cuba pole gracias en nombre de la redaccion de el nuevo p gracias por los mensajes de felicitacion recibidos hoy en nombre de la redaccion de el nuevo p gracias en nombre de la redaccion de el nuevo p gracias en nombre de la redaccion de el nuevo p gracias en nombre de la redaccion de el nuevo p gracias en nombre de la redaccion de el nuevo p gracias en nombre de la redaccion de el nuevo p gracias en nombre de la redaccion de el nuevo p gracias en nombre de la redaccion de el nuevo p gracias en nombre de la redaccion de el nuevo p gracias en nombre de la redaccion de el nuevo p gracias en nombre de la redaccion de el nuevo p gracias en nombre de la redaccion de el nuevo p gracias en nombre de la redaccion de el nuevo p gracias en nombre de la redaccion de el nuevo p gracias en nombre de la redaccion de el nuevo p gracias en nombre de la redaccion de el nuevo p gracias en nombre de la redaccion de el nuevo p gracias en nombre de la redaccion de el nuevo p gracias en nombre de la redaccion de el nuevo p oposicion presento su comando de campaña lo encabeza ramon guillermo aveled miraflores confia q pudreval no afecto imagen de chavez analisis de francisco ort aqui hace falta un hombre columna de rafael pole venezuela confisco equipo para elaborar pasaportes colombianos a diplomaticos en maiquet venezuela confisco equipo para elaborar pasaportes colombianos a diplomaticos en maiquet oposicion presento su comando de campaña lo encabeza ramon guillermo aveled miraflores confia q pudreval no afecto imagen de chavez analisis de francisco ort aqui hace falta un hombre columna de rafael pole link correcto a primera plana del domingo link correcto a primera plana del domingo problemas con twitpic en breve subiremos la primera plana del doming primera plana del domingo venezuela colombia g pole primera plana domingo venezuela colombia poleo g fotos en primera plana catastrofe ambiental en el lago de maracaibo gran mancha de crudo flotando en el agu socialismo para los pobres capitalismo para los del gobierno pastora medina rechaza ley de comun
37,CNB 102.3 FM,radio an inicio sus transmisiones a las am durante el acto conmemorativo de los diez años de la constituticion bolivarian mañana tendremos un programa especial en el espacio venezuela a dos voces escuchanos desde las am por an comienza a transmitir desde señal antes cnb grupo comando asesino a dos guardias nacionales en tachir terremoto de grados de magnitud en la escala richter sacudio el mar al sur de tonga en el pacif asesinan a secretario general de consejo legislativo del estado miranda gustavo gonzalez a partir del de noviembre usuarios de cadivi deberan notificar viajes al exterior venezuela solicita expulsion de secretario ejecutivo de cidh santiago canton ministro el aissami asegura que estan avanzando investigaciones sobre masacre en el estado tachir papa juan pablo ii sera beatificado entre abril y mayo d oea realizara asamblea general extraordinaria para reicorporar a honduras al organ transportistas de palo verde protestan por la insegur derrame de amoniaco en zona industrial de valent diputado mario isea reitera denuncia de conspiracion en venezuela por el das canasta alimentaria se ubico en bs f micheletti acepto acuerdo para restitucion de zelay an aprobo reforma a ley del banco central de venezuel trabajador liberado de alcaldia metropolitana recuerda que esta pendiente medida para lograr libertad de richard blanc colombia considera grave que venezuela posea documentos clasificados del das diosdado cabello gobierno no negociara con cemex bajo estructura colonial presidente chavez recibio credenciales de diez nuevos embaj anuncian cortes programados agua de noviembre a mayo en la ciudad de carac estudiantes viajaran este jueves a washington para exponer denuncias a la cidh fiscalia colombiana comprobo identidad de victimas de la masacre del tachir a partir del primero de enero de entrara en vigencia nueva providencia para otorgamiento de divis profesores de guayana exigen pago de deudas pendient ledezma aboga por ingreso de estado venezolano a mercosur pero con restricciones al actual gobiern consul de colombia investiga presunta masacre ocurrida en barinas en el mes de agost arias cardenas insto a colombia a cesar practicas de espionaj fedecamaras pide al gobierno programas racionamientos electricos con sectores econom denuncian despidos injustificados de sindicalistas del sector tribunalici maza zavala reforma a ley del bcv elimina autonom consecomercio establecimientos registran perdidas de hasta por fallas electr gobernador tachirense pide a gobierno hacer respetar soberania nacional uribe ordeno repatriacion de compatriotas asesinados en territorio venezolan diputado ismael garcia no descarta ningun mecanismo para lograr la un denuncian que un tercio del territorio tachirense esta tomado por grupos irregular chavez fustigo al ministro de defensa colombian incendio en refineria de puerto rico amenaza con grandes daños medioambiental manuitt se encuentra en condicion de refugiado en costa r fallas de electricidad se deben a falta de planificacion en los ultimos años segun expert diputado ángel rodriguez sera el nuevo ministro de energia electr defensor de asuntos penitenciarios continua retenido en rodeo ii presidenta argentina celebro la aprobacion de la ley de medios audiovisual an rechazo mocion del senado español sobre venezuel chavez anuncia creacion de ministerio de energia electr dirigentes politicos se debaten entre el mecanismo de las primarias y el consens pm reprime manifestacion de trabajadores de la universidad central de venezuel comienza inscripcion de plancha estudiantiles de cara a elecciones universitarias de la ucv el de noviembr gobierno nacional ocupa temporalmente central azucarero venezuel
38,NotiVe  Venezuela,atentar contra alguien que esta en lo correcto le contacto antes de publicar y el no la recib y por que no recibio a la periodista cuando solicito una entrevista antes publicar el reportaj el parlamento de venezuela investigara la financiacion al chavismo español y seguir rob ya van dos clinicas privadas que restringen sus servicios por falta de agua como sera en los hospitales venezuel asi 
39,Somos Radio,rt preparandose para la campaña electoral conatel piensa cerrar otras radios a nivel nacional que no son roj hoy se cumplen años del cierre arbitrario de cnb y mas de emisor chavez dice en argentina que en venezuela no se ha cerrado ningun medi emisora cerrada en carabobo recurre a la med conatel confisca equipos de carabobo stereo fm y cierra la emisora como medida cautel rt johan merchan miembro de la junta directiva del cnp llamo a seccionales a declararse en emergent rt la peleamos o la peleamos no hay opcion nos vemos hoy a las am en plaza rectorado ucv para marchar a la an sosuniv rt los universitarios nos movilizamos este jueves dic am plaza rectorado ucv pa la asamblea nacional sosinternetve rt carlos correa director de espacio publico fue agredido en puertas de la an a todos aquellos a quienes inquiete la aprobacion de la ley resorteme hoy a las en el centro cultural chacao asamblea v rt mañana de diciembre a las am los twitteros le dicen no a la censura desde el centro cultural chacao freeinternetve rt parlamento aprobara el jueves leyes habilitante resorte y de telecomunicaciones avn rt leydeinternet el estado puede revocar cualquier concesion cuando lo considere “conveniente a los intereses de la nacion” ya firmaron por una internet de contenido libre internetlibre internetve rt estamos reunidos en la ucab todas las universidades de ccs evaluando acciones pendientes de los anunci camara venezolana de la industria de la radiodifusion pretenden controlar la inform nelson belfort conatel es un organismo politico que persigue a los medi rt gracias a los circuitos radiales todo el pais se puede enterar de lo que sucede en cualquier rincon de venezuel la reforma a la ley de telecomunicaciones y ley resorte no afecta solo a los medios y periodistas afecta a todos la ley resorte fue promulgada hace años tambien en diciembre ahora la quieren reformar para terminarnos de call conoce los articulos del proyecto de reforma a la ley de telecomun rt la ley de telecomunicaciones puede acabar con la radiodifusion en vzla a organizarse y a no dejarse atropell rt nelson belfort ley de telecomunicaciones reservaria para el estado los circuitos radial rt rochetwitteros nos hemos aliado con el para sacar las franelas rocheleras gt los centros de acopio siguen abiertos haz tu donativo http lluviasve rt dic en la ucab concierto rockeros unidos por los damnificados trae tu donativo y disfruta de las bandas lluviasv rt servicios consulte la lista actualizada de centros de acopio en todo el p rt hoy se necesita en los refugios pañales para niños y adultos teteros vasos platos cubiertos y cobijas lluviasv
40,El Noticiero Televen,noticias dudamel “quiero un once inicialista que se erice cuando escuche el himno nacional” noticias foto converse lanza edicion especial “jenni rivera” noticias katy ferrer y santiago castillo van a ser padr noticias guardiola esta contento con el triunfo del wolfsburg noticias macri a disposicion de juez por caso de los papeles de panam noticias el papa pide mas aceptacion de familias no tradicional noticias video huawei lanzo su nuevo buque insignia el p noticias lista dudamel convoca a jugadores para la copa america centenari noticias leo aldana anuncia su salida de vitrin noticias luis chataing confirmo su salida de la mega est noticias españa convoca al embajador venezolano por palabras de maduro contra rajoy noticias postulados atletas para llevar el tricolor nacional en ri noticias aprobada en segunda discusion la ley de otorgamiento de titulos de propiedad a ben noticias julio borges pronunciamiento de herman escarra no tiene ninguna import urgente quimio citarabina de mg asparginasa ensure pediasure y enterex kid para niño de años contacto dale rt noticias la academia wayra anuncia su primera convocatoria del noticias messi si estara en el debut de la copa amer noticias aprueban recursos para becas de atletas y entren noticias dip mejia el tsj se ha convertido en una alcabala para evitar cambios en el p noticias roberto carlos figura en los papeles de panam noticias venezuela baila al ritmo de vocal song urgente para bebe recien nacido se solicita hidrasec de miligramos contacto dale rt noticias gobierno decreta los viernes como no labor noticias comision legislativa de brasil decidira el lunes sobre el juicio politico contra rousseff noticias tomas “the latin boy” confirma presentacion en los heat latin music awards noticias este jueves comienza la i copa caracas de ciclismo de p noticias rector rondon cne no posee exclusividad en iniciativas de ley en materia electoral
