,userNames,userTweets
16,Mery Mogollon,corte argentina ordeno reabrir la causa del “maletin” de antonini wilson diputado stefanelli denuncia irregularidades en centro de refinacion de paraguan racionamiento electrico seria mayor a seis horas continu empresario venezolano se declarara culpable de pagar sobornos a directivos de pdvs empresario venezolano se declarara culpable de pagar sobornos a directivos de pdvs venezuela se encuentra de ultimo en el reporte de los paises mas felices del mund instituto de medicina tropical de la ucv cerrara sus puertas por insegur could climate change be the culprit in spread of zika virus fiscal de brasil hay paginas de pruebas contra lula da silv oro petroleo y hasta diamantes empeña venezuela para levantar sus fin u s oil exports platts launches new price references for on ship crude oil in u s gulf coast mercado del petroleo podria ahogarse en sobreoferta en aie que paises son los mas afectados por la caida de los precios del petrole los paises en los que es mas barato y mas caro producir petrole el rabo de paja de la diputada tania diaz llega hasta pdvsa   ii venezuela tops world inflation estreno chicago boys centro cultural la moned venevision favor corregir mayoria simple no es la mitad mas uno sino cualquier numero mayor a de los diputados presentes en sesion venezuelans head to polls in pivotal election chavismo could get heave h  latimes in venezuela election maria corina machado is an opposition force though not on ballot in venezuela election maria corina machado is an opposition force though not on ballot venezuelan opposition calls for investigation of official s slaying u s proved oil and natural gas reserves rise in ‘bajamos nuestras ganancias pero mucho menos que las demas’ presidente de ecopetrol in venezuela students and faculty caught in budget driven university closur profesor le he dejado varios mensajes podemos hablar mery mogollon period cargueros de petroleo se quejan por falta de segur ecopetrol arranca la unidad de crudo de la nueva refineria de cartagen mil personas han quedado sin empleo por crisis del petrole minera canadiense reinicia operaciones en nicaragua tras protest vecinos cerraron paso a centro operacional de pdvsa y zona rural de el tigr october s planets on parade how and when to see them petroecuador despide personal por bajos precios del petrole actos en favor de petrobras reunen pequeños grupos en ciudades brasileñ fiebre por petroleo daña gravemente el ártico greenpeac condenan a años de carcel a extesorero del pt por caso petrobr even in jail i will fight for a free venezuel
17,Noticiero Venevisión,ejecutivo nacional recalco que en marzo ingresaron millones de dolares por venta de petrole keiko fujimori gana comicios pero tendra que disputar segunda vuelta segun sonde ministra iris varela indico que reten el marite pasara a ser una carcel nacional cierran colegios electorales de los comicios generales de peru centenares de muertos dejo un incendio en un templo de la indi sebin retuvo durante horas al director de la policia municipal de mer papa francisco envio sus condolencias a los afectados en el incendio de un templo en indi ollanta humala emitio su voto para elegir a su sucesor a la presidencia de peru oposicion se movilizara el proximo sabado para exigir la salida del presidente madur colombia deporto a venezolanos indocumentados que se encontraban en cucut dilma rousseff inauguro piscina olimpica a cuatro meses de los juegos ri marquez afirmo que el gobierno no gana otra eleccion debido a la crisis del p adan chavez aseguro que venezuela no ha tenido un presidente que haya llamado mas al dialogo como chavez bcv adjudico del bono directo por bs millon capriles asegura que el gobierno no quiere un referendum porque el pueblo tiene fuerza electoral para el cambi david cameron publicara su declaracion fiscal tras revelaciones de “panama papers” tintori recibio premio lindebraekk prize en noruega por defensa de los ddhh delincuentes matan a dos hombres por resistirse al robo de un vehiculo en maracaibo zuli protestas contra reforma laboral en francia registraron descenso de manifest abatido un presunto homicida al enfrentarse a comisiones del cicpc en guacara carabob asesinan a un hombre y su hijastro al quedar atrapados en un enfrentamiento entre bandas en petar mp acuso a tres gerentes de conviasa por corrupcion en la venta de bolet red de farmacias privadas aseguro que mantienen escasez de en medicinas mas busc “star wars el despertar de la fuerza” fue la gran ganadora en los mtv movie awards keiko fujimori ejercio su votacion en lima en los comicios presidencial estrenan trailer de la pelicula “hands of stone” protagonizada por edgar ramirez video cantante rob stewart afirma que teme que trump llegue a la presidencia de ee uu el principe guillermo y su esposa inician visita a la indi transporte publico de estados paralizara actividades el proximo miercol venezolano luis orta clasifico a ri salvador perez anoto dos rayitas en blanqueada de los real alberto moreno y origi comandan la goleada del liverpool ejecutivo nacional recalco que en marzo ingresaron millones de dolares por ingresos petroler mueren miembros de ei y civiles sirios en bombardeos en al raq ollanta humala emitio su voto para elegir a su sucesor a la presidencia de peru capriles asegura que el gobierno no quiere un referendum porque el pueblo tiene fuerza electoral para el cambi luis almagro pide tomar conciencia sobre situacion de los denominados presos polit inundaciones en argentina mantienen a mil personas evacu gobernador de aragua inauguro la primera base de misiones en la victori zulianos esperan el periodo de lluvia para que se aplaque la fuerte sequia de la region maduro informo que se han conformado mil comites locales de abastecimiento y produccion en todo el p manny pacquiao se despidio del boxeo por la puerta grand enrique marquez afirmo que en la guerra de poderes no gana nadi peruanos se preparan para elegir nuevo presidente este doming faria destaco que aspiran que ingresen al pais mas de millones de dolares producto de las export papa francisco envio sus condolencias a los afectados en el incendio de un templo en indi centenares de muertos dejo un incendio en un templo de la indi inameh pronostica un domingo nublado y sin lluvias en gran parte del p barcelona cayo en anoeta y da vida a atletico y real madr mp imputara al director del hospital luis razetti de barcelona por desvio de insumos med
18,Descifrado,decreto del presidente maduro que declara no laborables los dias viernes aparecio hoy en la gaceta n estamos presentando problemas tecnicos pedimos disculpas por los inconvenient estamos presentando problemas tecnicos pedimos disculpas por los inconvenient estamos presentando problemas tecnicos pedimos disculpas por los inconvenient estamos presentando problemas tecnicos pedimos disculpas por los inconvenient cartasemanal por fuera como la guayaber siganos tambien en linkedin inces se incorpora a plan de dias de la agricultura urban siganos tambien en facebook jesus seguias “no hay tiempo para que el revocatorio sea este año” construccion de viviendas por sector privado podria caer a mil unidades este añ mud combinara revocatorio y enmienda para adelantar cambio de gobiern omar barboza “es el momento de llamar a una constituyente” escasez de materia prima limito produccion del sef “revision economica solo la impulsara la oposicion” zonapriv oscar figuera alianza oficialista no tiene plan para enfrentar un revocatori cartasemanal por fuera como la guayaber carlos odoardo “este año no se resuelve el problema de los alimentos” laboratorios farmaceuticos perdieron millones de dolares por trato con bonos de pdvsa zonapriv venta de petroleo a nicaragua llego a niveles mas bajos desd alberto held “presupuesto de divisas debe dar prioridad a importacion de materia prima” motta dominguez asegura que “no habra un mega apagon” “gobierno tendra que reducir importaciones aun con reestructuracion de deuda” zonapriv advierten que inventario para elaboracion de medicamentos se agotara en abril sundde revisara aumento de matricula en univers an presentara plan economico el de abril “hoja de ruta de la mud aumentara tension politica” zonapriv conatel pide a telefonica dejar de aumentar tarifas internacional gobierno y ensambladoras acuerdan fabricar vehiculos en cinco añ google fue accesible en china por un par de hor sidor lleva dias paraliz fedecamaras insiste en que control de cambio “solo trae corrupcion y desabastec general mills vende negocios en venezuela con perdida de millon captaciones de publico del b o d subieron llegaron a bs millones en febrer bloomberg “nuevo bono pdvsa alarma a inversionistas” gobierno plantea incorporar el “poder popular” a la distribucion de aliment jesus silva advierte que podria introducir recurso ante el tsj para que firmas por revocatorio sean publ cartasemanal por fuera como la guayaber ford desmiente realizacion de concurso con camioneta ultimo modelo de premi movistar y mercantil establecen alianza de recargas bancari maduro a rajoy por que tiene que meterse en venezuel bancaribe aprueba nuevo aumento de capital social actividades del sector primario quedan exentas del pago del islr “china esta inconforme con medidas economicas tomadas en venezuela” designan al “potro” álvarez presidente del poliedro de carac “produccion de jabon azul en planta de polar se detendra indefinidamente” goodyear reanuda operaciones en planta de carabob mud intenta saldar compromisos politicos sin dejar de lado legislacion social zonapriv
19,Diario La Región,cinco homicidios la noche del viernes en capital mirandin desmantelan banda dedicada a comercializar armas de fuego por redes social pensar distinto al gobierno le costo años de su v cae microtraficante en la ciudad de los tequ matan a hombre en la calle ribas de los tequ por resistirse al robo le propinan balaz investigan a cristina fernandez por presunto lavado de diner diez muertos en brasil al chocar autobus atacado por asalt fue asesinado al salir de una fiesta en el club centro de amig santos pide a victimas defender proceso de paz ultimado adolescente tras enfrentamiento de la gnb en los barrial fraija “una vez por semana se distribuiran bolsas solidarias en cada comunidad” el “inhunduble” titanic se hundio hace añ mas de millones de peruanos convocados a la primera vuelta de las eleccion feria del pescado expende kilos de especi este domingo celebran la primera aparicion de la virgen de betani ocho toneladas de alimentos vendieron en la comunidad romulo galleg colombia deporto a venezolanos que estaban indocument saren comenzo jornada especial para tramitar documentos exentos de pag reten el marite sera ahora centro penitenciario dr francisco delg isturiz trabajadores de la educacion deben participar en formulacion de polit marquina tibisay lucena esta mint primera pagina de laregionweb de este domingo de abril perfil rafael dudamel tecnico mundialista y motivacional de la vinotint torrealba llama a movilizacion del pais para presionar “salida pacifica” madur real madrid golea a al eib canciller llama a promover el debate para defender al pueblo del asedio imperial manifestaciones en francia dejan her de la inconformidad popular al golpe del de abril murieron dos cuñados a tiros cuando presuntamente intentaron robar una mot productores de harinas alternativas promueve la produccion nacional cinco homicidios la noche del viernes en capital mirandin manifestaciones en francia dejan her desmantelan banda dedicada a comercializar armas de fuego por redes social pensar distinto al gobierno le costo años de su v matan a hombre en la calle rib cae microtraficante en la ciudad de los tequ investigan a cristina fernandez por presunto lavado de diner por resistirse al robo le propinan balaz fue asesinado al salir de una fiesta en el club centro de amig diez muertos en brasil al chocar autobus atacado por asalt santos pide a victimas defender proceso de paz ultimado adolescente tras enfrentamiento de la gnb en los barrial fraija “una vez por semana se distribuiran bolsas solidarias en cada comunidad” mas de millones de peruanos convocados a la primera vuelta de las eleccion el “inhunduble” titanic se hundio hace añ feria del pescado expende kilos de especi este domingo celebran la primera aparicion de la virgen de betani colombia deporto a venezolanos que estaban indocument ocho toneladas de alimentos vendieron en la comunidad romulo galleg
20,Aló Ciudadano,sip crimen organizado y corrupcion principales enemigos de los periodistas internacional perú elecciones asi votan los peruanos en el exterior internacional heridos por choque de trenes en costa rica internacional tras el escandalo petrobras quien queda limpio en brasil internacional llego la hora de que acordemos unas reglas de tecniqueta internacional como y cuando se inventaron los paraisos fiscales internacional presidente de ecuador pide no dejarse manipular por informacion de caso mossack fonseca internacional diario estadounidense muestra como seria el pais con trump como presidente internacional brasil argentina y mexico seran cabezas de serie en sorteo de futbol olimpico deport johan santana hara su ultimo intento deport djokovic buscara su tercer titulo en el masters de montecarlo deport marquez suma su segundo triunfo del año al ganar en austin deport productores carabobeños mostraron potencialidades para la produccion acuicola econom inauguran areas para optimizar el funcionamiento del hospital central de maracaibo venezuel enrique marquez queremos un tsj que no se arrodille ante el poder venezuel roberto enriquez recibira informacion detallada de los panama papers internacional tomas guanipa venezuela necesita gobierno de unidad nacional y de salvacion internacional mp acuso a tres gerentes de conviasa por corrupcion venezuel tomas guanipa venezuela necesita gobierno de unidad nacional y de salvacion venezuel obama no pensamos en el futuro de libia luego de la intervencion internacional pueblo argentino se movilizara este miercoles en respaldo a cristina fernandez internacional perú veronika mendoza no tenemos dinero para pagar personeros internacional el donald y hillary de amigos a enemigos internacional peruanos votan para elegir presidente con la vista puesta en el balotaje internacional detienen a dos policias de merida por extorsion venezuel españa el psoe recuerda a podemos que solo se opone a dos de sus veinte propuestas internacional presidente humala llamo a los peruanos a cumplir con su deber de votar este domingo venezuel margarita stolbizer dijo que oyarbide debera rendir cuentas en la justicia penal internacional an levanta inventario de problemas de la pesca en nueva esparta venezuel productores carabobeños mostraron potencialidades para la produccion acuicola venezuel keiko fujimori acudan a votar con ilusion internacional inaugurada unidad de cuidados intensivos del hospital central de maracaibo video venezuel fallece periodista guillermo vargas a los años venezuel inicio la jornada nacional de siembra por la patria en el estado carabobo venezuel como cambia tu cara despues de copas de vino internacional panama papers david cameron publico su declaracion de bienes y desato la polemica internacional asi emitieron su voto los candidatos presidenciales en peru internacional adan chavez el pueblo esta dispuesto a defender la revolucion como en abril de venezuel casi mil peruanos elegiran en chile a su proximo presidente este domingo internacional rusia y estados unidos reiteraron su compromiso con el alto el fuego en siria internacional fotos claves y datos generales de elecciones en peru internacional veronika mendoza no siente nerviosismo ante cualquier escenario internacional lucha por el segundo lugar marca elecciones presidenciales peruanas internacional venezuela brasil por que el 'impeachment' de la presidenta dilma es un golpe internacional hoy luis almagro tendra su ponencia en reunion de la sip venezuel se elevan a cuatro los muertos en emboscada terrorista en la selva de peru internacional elecciones en peru pedro pablo kuczynki hizo un llamado a la paz internacional keiko fujimori llega al centro de votacion en santiago de surco internacional pequeños y medianos productores de guarico recibieron financiamiento venezuel grave amenaza para el planeta internacional
21,Infocifras,el lord revienta las redes sociales venezuela entretenida y algo mas el lord revienta las redes sociales venezuela entretenida y algo mas el lord revienta las redes sociales venezuela entretenida y algo mas… felizdomingo el lord revienta las redes sociales venezuela entretenida y algo mas tachirapotencia el lord revienta las redes sociales venezuela entretenida y algo mas vzlarepudiaelchavismo el lord revienta las redes sociales venezuela entretenida y algo mas el lord revienta las redes sociales venezuela entretenida y algo mas el lord revienta las redes sociales venezuela entretenida y algo mas el lord revienta las redes sociales venezuela entretenida y algo mas el lord revienta las redes sociales venezuela entretenida y algo mas el lord revienta las redes sociales venezuela entretenida y algo mas el lord revienta las redes sociales venezuela entretenida y algo mas el lord revienta las redes sociales venezuela entretenida y algo mas el lord revienta las redes sociales venezuela entretenida y algo mas el lord revienta las redes sociales venezuela entretenida y algo mas el lord revienta las redes sociales venezuela entretenida y algo mas el lord revienta las redes sociales venezuela entretenida y algo mas el lord revienta las redes sociales venezuela entretenida y algo mas el lord revienta las redes sociales venezuela entretenida y algo mas el lord revienta las redes sociales venezuela entretenida y algo mas el lord revienta las redes sociales venezuela entretenida y algo mas el lord revienta las redes sociales venezuela entretenida y algo mas el lord revienta las redes sociales venezuela entretenida y algo mas el lord revienta las redes sociales venezuela entretenida y algo mas el lord revienta las redes sociales venezuela entretenida y algo mas el lord revienta las redes sociales venezuela entretenida y algo mas el lord revienta las redes sociales venezuela entretenida y algo mas el lord revienta las redes sociales venezuela entretenida y algo mas el lord revienta las redes sociales venezuela entretenida y algo mas el lord revienta las redes sociales venezuela entretenida y algo mas el lord revienta las redes sociales venezuela entretenida y algo mas el lord revienta las redes sociales venezuela entretenida y algo mas el lord revienta las redes sociales venezuela entretenida y algo mas el lord revienta las redes sociales venezuela entretenida y algo mas el lord revienta las redes sociales venezuela entretenida y algo mas el lord revienta las redes sociales venezuela entretenida y algo mas el lord revienta las redes sociales venezuela entretenida y algo mas el lord revienta las redes sociales venezuela entretenida y algo mas el lord revienta las redes sociales venezuela entretenida y algo mas el lord revienta las redes sociales venezuela entretenida y algo mas… se agoto el tiempo de maduro oea activa carta democratica a fin de m se agoto el tiempo de maduro oea activa carta democratica a fin de m se agoto el tiempo de maduro oea activa carta democratica a fin de m
22,Canal de Noticias,asilovivimos mindeporte a cecotto jr aqui hay gente que no tiene que comer cecotto deport asilovivimos nasa lanza cuatro satelites para estudiar la reconexion magnetica de la tierra cient ustedlovio tibisay lucena “la gente en el twitter a veces se vuelve loca” asilovivimos chileno arturo vidal envuelto en otra polemica por supuesta indisciplina arturovidal deport ustedlovio garcia carneiro desmiente que exista impuesto de usd asilovivimos vladimir villegas deja fuera de base a carreño por caso de globovisi pedrocarreno vladimirvilleg ustedlovio “la proxima de maduro sera decretar no laborable hasta fin de año” asilovivimos hasta motores de lanchas son robados semanalmente en margarita sucesos venezuel asilovivimos los mejores estiramientos para realizar en la oficina estiramiento oficin ustedlovio mohamed abrini sospechoso de atentados de paris detenido en brusel ustedlovio afp la crisis electrica da los viernes libres a venezolan asilovivimos tachira derroto a pumas y comparten liderato del grupo de libertadores pumas tachir fuenoticia hermann escarra reto a ramos allup a un debat asilovivimos maduro se reunio con el ministro de exterior ruso en ny maduro mund fuenoticia enmienda que reducira a dias periodo de los diputados “esta redactada” asilovivimos detienen en mexico a jefe financiero del cartel de el chapo mund asilovivimos inundaciones convierten en isla a una ciudad de paraguay mundo paraguay ustedlovio choque frontal de trenes deja heridos en costa r asilovivimos freddy guevara a tareck el aissami por esa actitud perdio t aragua freddyguevara tareckelaissami ustedlovio enh maduro usa la escasez como arma de represion en venezuel fuenoticia saab exhorta a “detener a los linchadores” del chef en los ruic ustedlovio sundde multo con ut a cadena de supermercados dia d asilovivimos cabello ninguna de las opciones de la mud para salida de maduro tendra exito cabello venezuel fuenoticia notificacion sobre investigacion a rafael ramirez se entrego en person fuenoticia chavismo se moviliza contra la amnist ustedlovio panama se compromete con francia a cooperar contra blanqueo de capital ustedlovio saquearon gandola que transportaba harina de maiz en el estado sucre fot asilovivimos copiloto que estrello avion oculto enfermedad a compañia germanwings mund asi saquearon un abasto en villa del rosario vide ustedlovio haro toda enmienda constitucional requiere un referendum fuenoticia david cameron admitio su participacion en un fondo offshore revelado por l colombia deporta a venezolanos por permanencia ilegal en el p fuenoticia texas ejecuta a un hombre que mato a un niño de años y bebio su sangr asilovivimos channing tatum sera parte de los x men escenari marc anthony y juanes actuaran en los billboard latin fuenoticia acaba con los malos olores en la oficin asilovivimos de los venezolanos compra la mitad o menos de lo que necesita economia venezuel fuenoticia smolansky sobre los viernes no laborables “es irresponsable” ustedlovio baroja y “miku” fueron los grandes descartes por dudamel para la copa amer asilovivimos muertos al estrellarse en alpes franceses un avion barcelona dusseldorf mund fuenoticia los datos que whatsapp excluye del sistema de cifr fuenoticia fesoca pide aumentar el kilo de azucar a bs asilovivimos hinterlaces de cada venezolanos votara en las parlamentarias cultura elecciones venezuel ustedlovio la version rusa de kim kardashi fuenoticia un invento barato con cauchos podria impulsar el control del zik ustedlovio ramos allup da por hecho que amnistia sera declarada ilegal fuenoticia lo que dijo el hombre que quemaron en los ruices antes de morir fot asilovivimos se cumplen años del discurso de bolivar ante el congreso de angostura boliv ustedlovio escasez general alcanzo y en los hogares se duplica al llegar  ustedlovio se escapo una puma de un zoologico en boliv
23,AnaMaria HernandezG.,los papelespanama parecen una enorme lista tascon jod papelespanama moraleja todo se sabe no hay nada oculto bajo el sol apamate rosa con ana margarita en la av urdaneta hasta se ve linda la ciudad quien lo diria … dime que esta cosita linda no es una cocha pechocha quien no lo conozca que lo compre giggi… alberto ginastera un enamorado de su tierra listo publicado y tuit un suspiro de nostalgia por frank quinter trina medina salsa con amor al art rock desde la nostalgia nicky scarol chica negra del rock gladys knight la musica si paga en soundcloud ya llegan los pepsi music tiempo para amar el sonido de édgar alexand mas que un concierto de rock en cub el reggaeton visto por los universitari el streaming versus la musica en v look buena vista social club yordano profund “is the love” un reaggae electron no habia forma de salir de la piscina nos salieron escamas higuerote estado mirand payasita anita y anota version corregida y aumentada de bananin y bananon higuerote estado… amoamihija en higuerote la pasamos super higuerote estado mirand un fin de semana necesario para nuestra salud mental perfecto amoamifamilia anita rober y yo… las academias venezolanas iniciaron el año cervantino con musica a cargo de cumbe y zarambequ colegas echense un paseito por venezuela aqui esa crisis nos revienta y da para mil histori esa gatita embarazada se monto encima y no se paro hasta que le dio la realisima gana como buen… los años de alirio diaz cuantos detenidos habra hoy por quemar judas alusivos  felices pascuas de resurreccion dobla con alegria las campanas en la candelaria carac hace una hora fallecio el actor carlos marquez venia padeciendo de una afeccion pulmonar paz a sus rest
